,Text,language,english
721,Whether its some lip gloss to get through the day or a statement winged eyeliner LakmÃ© has been a womans best friend over the past decades  A Make in India project Lakme Cosmetics was the first indigenouslydeveloped makeup brand to have been introduced in the country in the s   Link in bio to this weeks BrandMa by Sukriti Vats   lakme lakmecosmetics jawaharlalnehru lakshmicosmetics ,en,Whether its some lip gloss to get through the day or a statement winged eyeliner LakmÃ© has been a womans best friend over the past decades  A Make in India project Lakme Cosmetics was the first indigenouslydeveloped makeup brand to have been introduced in the country in the s   Link in bio to this weeks BrandMa by Sukriti Vats   lakme lakmecosmetics jawaharlalnehru lakshmicosmetics 
722,  FOR MORE FOLLOW vr_beautybliss_  PRODUCTS USED  lakmeindia  Absolute spotlight eye shadow  palette    to  primer  matte perfect cover foundation   eyeconic curling mascara  lakme lakmecosmetics lakmekajal lakmeeyeshadow shadoweye eyeshadow naviblue makeupoftheday wednesdaymakeup  mua vrbeautybliss ,en,  FOR MORE FOLLOW vr_beautybliss_  PRODUCTS USED  lakmeindia  Absolute spotlight eye shadow  palette    to  primer  matte perfect cover foundation   eyeconic curling mascara  lakme lakmecosmetics lakmekajal lakmeeyeshadow shadoweye eyeshadow naviblue makeupoftheday wednesdaymakeup  mua vrbeautybliss 
723,Why stick with boring hair when your dream makeover is just a LakmÃ© Salon visit away  Come over to twirl the tresses of your dreams  LakmÃ©Salon InvestInSkin SkinCare MakeAHabit Skin HappySkin HappyYou SkinRoutine ,en,Why stick with boring hair when your dream makeover is just a LakmÃ© Salon visit away  Come over to twirl the tresses of your dreams  LakmÃ©Salon InvestInSkin SkinCare MakeAHabit Skin HappySkin HappyYou SkinRoutine 
724,Aftercare products that suit all your needs are hard to catch isnt it true Why go through hitandtrial when you can shop expertrecommended products on our webshop   LakmÃ©Salon InvestInSkin SkinCare MakeAHabit Skin HappySkin HappyYou ,en,Aftercare products that suit all your needs are hard to catch isnt it true Why go through hitandtrial when you can shop expertrecommended products on our webshop   LakmÃ©Salon InvestInSkin SkinCare MakeAHabit Skin HappySkin HappyYou 
725,Had a wonderful Time with lakmesalon   Got the best results with dermalogicain  for my skin        lakmesalon dermalogicain   LakmÃ©Salon InvestInSkin SkinCare MakeAHabit Skin HappySkin HappyYou skinroutine   LakmÃ©Salon InvestInSkin SkinCare MakeAHabit Skin HappySkin HappyYou skinroutine ,en,Had a wonderful Time with lakmesalon   Got the best results with dermalogicain  for my skin        lakmesalon dermalogicain   LakmÃ©Salon InvestInSkin SkinCare MakeAHabit Skin HappySkin HappyYou skinroutine   LakmÃ©Salon InvestInSkin SkinCare MakeAHabit Skin HappySkin HappyYou skinroutine 
726,Drop a  if you cant take your eyes off Nayantharas wedding ensemble This stunning look by puneetbsaini and amitthakur_hair is taking over our hearts Don this look on your big day with LakmÃ© Salon  LakmÃ©Salon Queentessential Bridal MakeUp QueentessentialBride HappyHair HappyYou WeddingLook Nayanthara ,en,Drop a  if you cant take your eyes off Nayantharas wedding ensemble This stunning look by puneetbsaini and amitthakur_hair is taking over our hearts Don this look on your big day with LakmÃ© Salon  LakmÃ©Salon Queentessential Bridal MakeUp QueentessentialBride HappyHair HappyYou WeddingLook Nayanthara 
727,Make dermalogicain s CETM your mantra for glowing skin C Cleanse E Exfoliate T Tone M Moisturize  Shop these expertrecommended skincare products on our webshop  LakmÃ©Salon InvestInSkin SkinCare MakeAHabit Skin HappySkin HappyYou SkinRoutine ,en,Make dermalogicain s CETM your mantra for glowing skin C Cleanse E Exfoliate T Tone M Moisturize  Shop these expertrecommended skincare products on our webshop  LakmÃ©Salon InvestInSkin SkinCare MakeAHabit Skin HappySkin HappyYou SkinRoutine 
728,Time to Level UP in product photography  lakme lakmÃ© lakmefashionweek lakmeindia lakmelipstick lakmefoundation lakmefoundationonemakeuponline lakmepowderfoundation lakmepowder lakmecosmetics cosmatic cosmaticsphotography productphotography add addvertising addvertisment addvertisingphotographer studio studiophotographer studiophotography studiolifestyle studiolighting ladies ladiesfashion makeup fashion fashionstyle fashionblogger ,fr,
729,Were not sure if his jokes will get any better after a visit to LakmÃ© Salon but we do know that when you PamperYourPapa he will look good and feel great too  LakmÃ©Salon PamperYourPapa HappyFathersDay HappyYou CelebrateFathers Celebration QualityTime SpecialDay ,en,Were not sure if his jokes will get any better after a visit to LakmÃ© Salon but we do know that when you PamperYourPapa he will look good and feel great too  LakmÃ©Salon PamperYourPapa HappyFathersDay HappyYou CelebrateFathers Celebration QualityTime SpecialDay 
730,come lets pamper the men who pampered us their entire lives with these amazing services provided by lakmesalon    lakmÃ©salon pamperyourpapa happyfathersday happyyou celebratefathers celebration qualitytime specialday reelsinstagram reels reelitfeelit reelsvideo reelsviral reelsinsta sage ,en,come lets pamper the men who pampered us their entire lives with these amazing services provided by lakmesalon    lakmÃ©salon pamperyourpapa happyfathersday happyyou celebratefathers celebration qualitytime specialday reelsinstagram reels reelitfeelit reelsvideo reelsviral reelsinsta sage 
731,Every day is a good day to PamperYourPapa Today even more so   HappyFathersDay to your inhouse comedian  ATM  Come celebrate this day at LakmÃ© Salon  LakmÃ©Salon PamperYourPapa HappyFathersDay HappyYou CelebrateFathers Celebration QualityTime SpecialDay ,en,Every day is a good day to PamperYourPapa Today even more so   HappyFathersDay to your inhouse comedian  ATM  Come celebrate this day at LakmÃ© Salon  LakmÃ©Salon PamperYourPapa HappyFathersDay HappyYou CelebrateFathers Celebration QualityTime SpecialDay 
732,Pampering my favourite person First best friend and My forever with these amazing services provided by lakmesalon  PamperYourPapa HappyFathersDay LakmeSalon celebratefathers ,en,Pampering my favourite person First best friend and My forever with these amazing services provided by lakmesalon  PamperYourPapa HappyFathersDay LakmeSalon celebratefathers 
733,With a spike in the frequency of visits to LakmÃ© Salon comes a spike in excuses for a salon visit Beware as you see PamperYourPapa for he may become our next Showstoppertier customer   PS Dont forget to tag along   LakmÃ©Salon PamperYourPapa HappyFathersDay HappyYou CelebrateFathers Celebration QualityTime SpecialDay ,en,With a spike in the frequency of visits to LakmÃ© Salon comes a spike in excuses for a salon visit Beware as you see PamperYourPapa for he may become our next Showstoppertier customer   PS Dont forget to tag along   LakmÃ©Salon PamperYourPapa HappyFathersDay HappyYou CelebrateFathers Celebration QualityTime SpecialDay 
734,Lakme Eyeconic Volume Mascara  Deep Blackml  Wear under your Favourite branded Lakme healthy mix makeup collection Best Lakme nail polish and Hydra Energetic antifatigue moisturizer For flawless imperfectionfree skin Best Branded Lakme Purfumes in all Style and Quality For Eyeshadow EyeLiner and baby lotion Flaunt the classic red lip look play it down with a subtle nude lipstick Lakme mascara mascara to help you create your perfect eyecatching lash look  Stock Available   SHOP NOW   blinglifestyle finditloveitwearit mauritius lakmemakeup lakmecosmetics lakmemascarawaterproof volumemascara eyeiconic velplazagoodland couerdevilleflacq arcadekhodadinflacq RiversideShoppingComplex ,en,Lakme Eyeconic Volume Mascara  Deep Blackml  Wear under your Favourite branded Lakme healthy mix makeup collection Best Lakme nail polish and Hydra Energetic antifatigue moisturizer For flawless imperfectionfree skin Best Branded Lakme Purfumes in all Style and Quality For Eyeshadow EyeLiner and baby lotion Flaunt the classic red lip look play it down with a subtle nude lipstick Lakme mascara mascara to help you create your perfect eyecatching lash look  Stock Available   SHOP NOW   blinglifestyle finditloveitwearit mauritius lakmemakeup lakmecosmetics lakmemascarawaterproof volumemascara eyeiconic velplazagoodland couerdevilleflacq arcadekhodadinflacq RiversideShoppingComplex 
735,Whatever be your style Lakme Salon has got your back Come on over to look good  feel great  LakmÃ©Salon PrideMonth CelebratePride HappyYou LoveIsLove FlauntWithPride ,en,Whatever be your style Lakme Salon has got your back Come on over to look good  feel great  LakmÃ©Salon PrideMonth CelebratePride HappyYou LoveIsLove FlauntWithPride 
736,Lipstick That Defines the Best Version of Beauty  trysugar lovecolorbar myglamm and lakmeindia lipstick are available at Abhushanam  Free home delivery on orders above Rs   Please call us at    Visit Abhushnam Near Devta Sweets DC Colony Market Hisar  sugar sugarlipstick sugarcosmetics colorbar colorbarlipstick colorbarcosmetics colorbarproducts lakme lakmelipstick lakmecosmetics lakmeproducts myglamm myglammcosmetics myglammlipstick lips lipstick look beauty newlook available homedelivery freehomedelivery ordernow discountoffer cosmetics cosmeticsproduct elegance matches hisar abhushanam ,en,Lipstick That Defines the Best Version of Beauty  trysugar lovecolorbar myglamm and lakmeindia lipstick are available at Abhushanam  Free home delivery on orders above Rs   Please call us at    Visit Abhushnam Near Devta Sweets DC Colony Market Hisar  sugar sugarlipstick sugarcosmetics colorbar colorbarlipstick colorbarcosmetics colorbarproducts lakme lakmelipstick lakmecosmetics lakmeproducts myglamm myglammcosmetics myglammlipstick lips lipstick look beauty newlook available homedelivery freehomedelivery ordernow discountoffer cosmetics cosmeticsproduct elegance matches hisar abhushanam 
737,When you invest in your skin and body your skin will always look good and feel great   Celebrate InternationalYogaDay with a postworkout Relaxing Body Massage at LakmÃ© Salon to up your glowgame  LakmÃ©Salon InternationalYogaDay InvestInSkin SkinCare MakeAHabit Skin HappySkin HappyYou SkinRoutine ,en,When you invest in your skin and body your skin will always look good and feel great   Celebrate InternationalYogaDay with a postworkout Relaxing Body Massage at LakmÃ© Salon to up your glowgame  LakmÃ©Salon InternationalYogaDay InvestInSkin SkinCare MakeAHabit Skin HappySkin HappyYou SkinRoutine 
738,Its the season to start your SkinInvestmentPlan with LakmÃ© Salon  Rain or not make skincare a habit to glow round the year  LakmÃ©Salon InvestInSkin SkinCare MakeAHabit Skin HappySkin HappyYou SkinRoutine ,en,Its the season to start your SkinInvestmentPlan with LakmÃ© Salon  Rain or not make skincare a habit to glow round the year  LakmÃ©Salon InvestInSkin SkinCare MakeAHabit Skin HappySkin HappyYou SkinRoutine 
739,Its the season to start your SkinInvestmentPlan with LakmÃ© Salon  Rain or not make skincare a habit to glow round the year  LakmÃ©Salon InvestInSkin SkinCare MakeAHabit Skin HappySkin HappyYou SkinRoutine ,en,Its the season to start your SkinInvestmentPlan with LakmÃ© Salon  Rain or not make skincare a habit to glow round the year  LakmÃ©Salon InvestInSkin SkinCare MakeAHabit Skin HappySkin HappyYou SkinRoutine 
740,Its the season to start your SkinInvestmentPlan with LakmÃ© Salon  Rain or not make skincare a habit to glow round the year  LakmÃ©Salon InvestInSkin SkinCare MakeAHabit Skin HappySkin HappyYou SkinRoutine ,en,Its the season to start your SkinInvestmentPlan with LakmÃ© Salon  Rain or not make skincare a habit to glow round the year  LakmÃ©Salon InvestInSkin SkinCare MakeAHabit Skin HappySkin HappyYou SkinRoutine 
741,Investing in this nail transformation will bring you truly glamorous returns   Toh batao LakmÃ© Salon SIP mein invest kiya kya  LakmÃ©Salon InvestInNails nails MakeAHabit NailArt NailTransformation ,en,Investing in this nail transformation will bring you truly glamorous returns   Toh batao LakmÃ© Salon SIP mein invest kiya kya  LakmÃ©Salon InvestInNails nails MakeAHabit NailArt NailTransformation 
742,lakmeindia  lakmefashionwk  lakmesalon    lakme lakmefashionweek lakmelipstick lakmecosmetics cosmetics pandu__ dark_clicks ishita sravanibellana sravanibellana_ sravanibellana newpost edits beautiful boom bhfyp blogger hairstyle fashionstyle fashiondesigner bloggersofinstagram instaphoto instagramreels imspandana flowers homedecoration lakmefashionweek weekendgetaway viral explorepage ktmindia ,en,lakmeindia  lakmefashionwk  lakmesalon    lakme lakmefashionweek lakmelipstick lakmecosmetics cosmetics pandu__ dark_clicks ishita sravanibellana sravanibellana_ sravanibellana newpost edits beautiful boom bhfyp blogger hairstyle fashionstyle fashiondesigner bloggersofinstagram instaphoto instagramreels imspandana flowers homedecoration lakmefashionweek weekendgetaway viral explorepage ktmindia 
743,lakme cosmetics   S B  RAJSHRUNGI COMPLAX OPP ASHAPURA TEMPLE PALACE ROAD RAJKOT   JOIN whatsapp        lakmeindia lakmeabsolute lakmelipstick lakmemakeup lakmeto lakmifashionweek lakmemakeup lakmecolour lakmeproducts lakme lakmefoundation lakmeskincare lakmefashion lakmenailpolish lakmecosmetics lakmeeyeliner lakmebeauty lakmetolipstick Sajke rajkot_instagram ,en,lakme cosmetics   S B  RAJSHRUNGI COMPLAX OPP ASHAPURA TEMPLE PALACE ROAD RAJKOT   JOIN whatsapp        lakmeindia lakmeabsolute lakmelipstick lakmemakeup lakmeto lakmifashionweek lakmemakeup lakmecolour lakmeproducts lakme lakmefoundation lakmeskincare lakmefashion lakmenailpolish lakmecosmetics lakmeeyeliner lakmebeauty lakmetolipstick Sajke rajkot_instagram 
744,Atelier Opening Outhouse at FDCI X LakmÃ© Fashion Week  Outhouses collection OH Dopamine was all about celebrating a strong sense of self expression in an unapologetic way From an idyllic escape into the world of fantasies to an eclectic sense of being ones unapologetic self the designers rediscovered the joys in the little memories from their past by diving into the exuberant spirit of the s Encapsulating the very essence of the YK era the line featured colourful beads resin seed beads raffia and even enamel with each creation having its own individualistic charm Echoing the strong voice of the collection the pieces are an interplay as a motley of silver plating combined with matte silver along with crystals and rhinestones Their exceptional craftsmanship shone through their exquisite handbags shining bright with metallic undertones  outhousejewellery lakmesalon lakmeindia nexaexperience fdciofficial rseworldwide  ExploreMore FDCIxLakmÃ©FashionWeek LakmÃ©FashionWeek FDCIxLFW DaysOfFashion LFW ,en,Atelier Opening Outhouse at FDCI X LakmÃ© Fashion Week  Outhouses collection OH Dopamine was all about celebrating a strong sense of self expression in an unapologetic way From an idyllic escape into the world of fantasies to an eclectic sense of being ones unapologetic self the designers rediscovered the joys in the little memories from their past by diving into the exuberant spirit of the s Encapsulating the very essence of the YK era the line featured colourful beads resin seed beads raffia and even enamel with each creation having its own individualistic charm Echoing the strong voice of the collection the pieces are an interplay as a motley of silver plating combined with matte silver along with crystals and rhinestones Their exceptional craftsmanship shone through their exquisite handbags shining bright with metallic undertones  outhousejewellery lakmesalon lakmeindia nexaexperience fdciofficial rseworldwide  ExploreMore FDCIxLakmÃ©FashionWeek LakmÃ©FashionWeek FDCIxLFW DaysOfFashion LFW 
745,Presenting Diksha Khanna at FDCI X LakmÃ© Fashion Week  dikshakhannas collection titled Julley or Hello in Ladakhi was inspired by the barren landscape of Ladakh The transseasonal  fluid line entails traditional costumes that were interpreted in insightful shapes and dexterous detailing making ensembles mostly androgynous She went back to the roots to explore ecoprinting a form of natural dyeing on textiles to extract the natural beauty of plants  foliage  lakmeindia nexaexperience fdciofficial rseworldwide  ExploreMore FDCIxLakmeFashionWeek LakmeFashionWeek FDCIxLFW DaysOfFashion LFW yearsofSFD SustainableFashionDay ChangeIsGood ,en,Presenting Diksha Khanna at FDCI X LakmÃ© Fashion Week  dikshakhannas collection titled Julley or Hello in Ladakhi was inspired by the barren landscape of Ladakh The transseasonal  fluid line entails traditional costumes that were interpreted in insightful shapes and dexterous detailing making ensembles mostly androgynous She went back to the roots to explore ecoprinting a form of natural dyeing on textiles to extract the natural beauty of plants  foliage  lakmeindia nexaexperience fdciofficial rseworldwide  ExploreMore FDCIxLakmeFashionWeek LakmeFashionWeek FDCIxLFW DaysOfFashion LFW yearsofSFD SustainableFashionDay ChangeIsGood 
746,Rainy day or not facials for healthy skin with our SkinInvestmentPlan are always a great idea  Buy  facial services get  free  LakmÃ©Salon InvestInSkin SkinCare MakeAHabit Skin HappySkin HappyYou SkinRoutine ,en,Rainy day or not facials for healthy skin with our SkinInvestmentPlan are always a great idea  Buy  facial services get  free  LakmÃ©Salon InvestInSkin SkinCare MakeAHabit Skin HappySkin HappyYou SkinRoutine 
747,Presenting Pawan Sachdeva at FDCI x LakmÃ© Fashion Week  A range of immaculately tailored ensembles Pawan Sachdevas collection at FDCI X LakmÃ© Fashion Week MenVerse showcases a reinvented collection to give athletic vibes catered to the sartorial needs of the New Age male Indulging in textures the designer has played with simple fabrics like cotton weaves leather PU crepe lycra and knits for effortlessly styled looks Each garment is designed to appeal to masses who are as freespirited expressive and classic as his inspiration  aparshakti_khurana pawansachdeva lakmeindia nexaexperience fdciofficial rseworldwide   ExploreMore FDCIxLakmÃ©FashionWeek LakmÃ©FashionWeek FDCIxLFW DaysOfFashion LFW ,en,Presenting Pawan Sachdeva at FDCI x LakmÃ© Fashion Week  A range of immaculately tailored ensembles Pawan Sachdevas collection at FDCI X LakmÃ© Fashion Week MenVerse showcases a reinvented collection to give athletic vibes catered to the sartorial needs of the New Age male Indulging in textures the designer has played with simple fabrics like cotton weaves leather PU crepe lycra and knits for effortlessly styled looks Each garment is designed to appeal to masses who are as freespirited expressive and classic as his inspiration  aparshakti_khurana pawansachdeva lakmeindia nexaexperience fdciofficial rseworldwide   ExploreMore FDCIxLakmÃ©FashionWeek LakmÃ©FashionWeek FDCIxLFW DaysOfFashion LFW 
748,Trendsetting fresh  experimental make up looks as seen at FDCI x LakmÃ© Fashion Week  lakmeindia fdciofficial rseworldwide  ExploreMore FDCIXLakmÃ©FashionWeek FDCIxLFW LFW LakmÃ©FashionWeek DaysOfFashion FDCI ,en,Trendsetting fresh  experimental make up looks as seen at FDCI x LakmÃ© Fashion Week  lakmeindia fdciofficial rseworldwide  ExploreMore FDCIXLakmÃ©FashionWeek FDCIxLFW LFW LakmÃ©FashionWeek DaysOfFashion FDCI 
749,Trendsetting fresh  experimental make up looks as seen at FDCI x LakmÃ© Fashion Week  lakmeindia fdciofficial rseworldwide  ExploreMore FDCIXLakmÃ©FashionWeek FDCIxLFW LFW LakmÃ©FashionWeek DaysOfFashion FDCI ,en,Trendsetting fresh  experimental make up looks as seen at FDCI x LakmÃ© Fashion Week  lakmeindia fdciofficial rseworldwide  ExploreMore FDCIXLakmÃ©FashionWeek FDCIxLFW LFW LakmÃ©FashionWeek DaysOfFashion FDCI 
750,The chance to apply for a historic fashion program is now here Apply for inifdoffical  presents GenNext via the link in bio  lakmeindia nexaexperience fdciofficial rseworldwide  GenNextAtLFW LakmeFashionWeek LFW FDCIxLFW DaysOfFashion ,en,The chance to apply for a historic fashion program is now here Apply for inifdoffical  presents GenNext via the link in bio  lakmeindia nexaexperience fdciofficial rseworldwide  GenNextAtLFW LakmeFashionWeek LFW FDCIxLFW DaysOfFashion 
751,Give your label a chance to shine on the biggest fashion event in the country Heres your chance to apply for FDCI x LakmÃ© Fashion Week Designer program today  Applications open  Visit the link in bio for details  lakmeindia nexaexperience fdciofficial rseworldwide  FDCIXLFW FDCIXLakmeFashionWeek DaysOfFashion ,en,Give your label a chance to shine on the biggest fashion event in the country Heres your chance to apply for FDCI x LakmÃ© Fashion Week Designer program today  Applications open  Visit the link in bio for details  lakmeindia nexaexperience fdciofficial rseworldwide  FDCIXLFW FDCIXLakmeFashionWeek DaysOfFashion 
752,Lakme Perfect Radiance Skin Lightning Foundation With spf  Price  Dm To Orders  queencosmetic Shipping All Over INDIA  queencosmetic foundation facecare lakmecosmetics makeup skincare skincareproducts shippingalloverindia shippingavailable shoppingindia shoppingtime kanpurshopping kanpur uttarpradesh india explore lakmeproducts lakmemakeup shippingavailable ,en,Lakme Perfect Radiance Skin Lightning Foundation With spf  Price  Dm To Orders  queencosmetic Shipping All Over INDIA  queencosmetic foundation facecare lakmecosmetics makeup skincare skincareproducts shippingalloverindia shippingavailable shoppingindia shoppingtime kanpurshopping kanpur uttarpradesh india explore lakmeproducts lakmemakeup shippingavailable 
753,Coords are everyones happy place this season   They are the perfect mix of style  comfort Here are a few that dominated the runway   lakmeindia nexaexperience fdciofficial rseworldwide   ExploreMore FDCIxLakmÃ©FashionWeek LakmÃ©FashionWeek FDCIxLFW DaysOfFashion ,en,Coords are everyones happy place this season   They are the perfect mix of style  comfort Here are a few that dominated the runway   lakmeindia nexaexperience fdciofficial rseworldwide   ExploreMore FDCIxLakmÃ©FashionWeek LakmÃ©FashionWeek FDCIxLFW DaysOfFashion 
754,ORGANIC BALANCE izsmidzinÄma eÄ¼Ä¼a  mÄ«kstina pabaro matus un galvas Ädu PiemÄ“rota lietoÅ¡anai arÄ« kÄ Ä·ermeÅ†a eÄ¼Ä¼a DEEP CARE DROPS  serums kurÅ¡ mÄ«kstina matus un atjauno Å¡Ä·eltus matu galus Izveido aizsargbarjeru pret matu lÅ«Å¡anu Padara matus vijÄ«gus  ARGAN sausÄ eÄ¼Ä¼a  vieglas tekstÅ«ras barojoÅ¡a eÄ¼Ä¼a MÄ«kstina matus pieÅ¡Ä·ir spÄ«dumu atvieglo Ä·emmÄ“Å¡anu PalÄ«dz savaldÄ«t sprogas FULL DEFENCE  serums kurÅ¡ aizsargÄ un atjauno mata Å¡Ä·iedru PieÅ¡Ä·ir intensÄ«vu spÄ«dumu un zÄ«dainu mÄ«kstumu AizsargÄ no ÄrÄ“jÄs vides ietekmes tajÄ skaitÄ no UV stariem  kosmÄ“tikasveikals kosmÄ“tika skaistumkopÅ¡ana skaistimati matukopÅ¡ana gludimati lakmecosmetics lakme ,lv,
755,tencel_luxe presents JJV BY JJ Valayas collection RumeliThe Summer Story at FDCI X LakmÃ© Fashion Week was engineered with a sensitivity towards sustainability This year as the luxury occasion wear brand celebrates its th year in fashion it takes a step further by launching its allnew bridgetoluxury brand JJV The new brand debuted with an ecoconscious collection made from TENCEL LUXE filament yarn which is a sustainable ecofriendly and vegan alternative to silk Derived from renewable wood sources in a closed loop lyocell process TENCEL LUXE filament yarn is set to define the landscape of luxury fashion with its silky smoothness liquidlike drape color vibrancy and yarn strength JJV is an occasion wear brand that revolves around the spirit of travel  with this exquisite line it embraces the need where one can still maintain a unique sense of personal style without the use of any heavy embroideries   mrunalthakur jjvalaya tencel_luxe lakmeindia fdciofficial rseworldwide   ExploreMore FDCIxLakmÃ©FashionWeek LakmÃ©FashionWeek FDCIxLFW DaysOfFashion LFW TencelLuxeatFDCIxLFW Tencelluxe Vegan Vegansilk sustainablesilk consciousluxury ,en,tencel_luxe presents JJV BY JJ Valayas collection RumeliThe Summer Story at FDCI X LakmÃ© Fashion Week was engineered with a sensitivity towards sustainability This year as the luxury occasion wear brand celebrates its th year in fashion it takes a step further by launching its allnew bridgetoluxury brand JJV The new brand debuted with an ecoconscious collection made from TENCEL LUXE filament yarn which is a sustainable ecofriendly and vegan alternative to silk Derived from renewable wood sources in a closed loop lyocell process TENCEL LUXE filament yarn is set to define the landscape of luxury fashion with its silky smoothness liquidlike drape color vibrancy and yarn strength JJV is an occasion wear brand that revolves around the spirit of travel  with this exquisite line it embraces the need where one can still maintain a unique sense of personal style without the use of any heavy embroideries   mrunalthakur jjvalaya tencel_luxe lakmeindia fdciofficial rseworldwide   ExploreMore FDCIxLakmÃ©FashionWeek LakmÃ©FashionWeek FDCIxLFW DaysOfFashion LFW TencelLuxeatFDCIxLFW Tencelluxe Vegan Vegansilk sustainablesilk consciousluxury 
756,Our ManCrushMonday someone who invests in selfcare  LakmÃ©Salon ManCrushMondays SelfCare InvestInSkin SkinCare MakeAHabit Skin HappySkin HappyYou SkinRoutine ,en,Our ManCrushMonday someone who invests in selfcare  LakmÃ©Salon ManCrushMondays SelfCare InvestInSkin SkinCare MakeAHabit Skin HappySkin HappyYou SkinRoutine 
