,Text,language,english
207,AwakenYourFestiveSpirit  Make a lasting impression this Eid with LakmÃ© Salons elegant looks   Swipe to see all the steps to follow  Describe your favorite festive look in the comments and we will tell you how to get it   Visit your nearest Safer Than Home LakmÃ© Salon to get your own elegant Eid look Pay   avail services worth  for a look that is just priceless   on    to prebook your appointment  Certified Safer Than Home based on a survey amongst  customers  LakmeSalon Eid MagicMoments BackstageHeroes SaferThanHome Inspiring BehindTheScenes SalonExperts RevampYourLook HappyHair HappyTresses HairColor HairTransformation HairColorInspiration BookYourAppointment FlauntYourStyle HairCare Nourish Shine ShadesOfSpice Schwarzkopf ,en,AwakenYourFestiveSpirit  Make a lasting impression this Eid with LakmÃ© Salons elegant looks   Swipe to see all the steps to follow  Describe your favorite festive look in the comments and we will tell you how to get it   Visit your nearest Safer Than Home LakmÃ© Salon to get your own elegant Eid look Pay   avail services worth  for a look that is just priceless   on    to prebook your appointment  Certified Safer Than Home based on a survey amongst  customers  LakmeSalon Eid MagicMoments BackstageHeroes SaferThanHome Inspiring BehindTheScenes SalonExperts RevampYourLook HappyHair HappyTresses HairColor HairTransformation HairColorInspiration BookYourAppointment FlauntYourStyle HairCare Nourish Shine ShadesOfSpice Schwarzkopf 
208,TheAwakening by LakmÃ© Salon x Chola at FDCI x LakmÃ© Fashion Week was a celebration of letting go being uninhibited and being our most authentic selves   The long layered braided look embraces the natural texture of the hair with roasted almond highlights to add softness and warmth Longer hair is interlaced with cornrows and twists to add to the quirky look Sharp winged eyeliner with glossy lips and dewy skin complements the look making it the perfect stunner whether on the runway or the streets  Love this look  Don it yourself at Safer Than Home LakmÃ© Salon   us on    to prebook your appointment  DefinetoRedefine FDCIxLFW FDCIxLakmeFashionWeek LakmeFashionWeek TheAwakening Chola CholabySohayaMisra LakmeSalon LakmeSalonXChola ,en,TheAwakening by LakmÃ© Salon x Chola at FDCI x LakmÃ© Fashion Week was a celebration of letting go being uninhibited and being our most authentic selves   The long layered braided look embraces the natural texture of the hair with roasted almond highlights to add softness and warmth Longer hair is interlaced with cornrows and twists to add to the quirky look Sharp winged eyeliner with glossy lips and dewy skin complements the look making it the perfect stunner whether on the runway or the streets  Love this look  Don it yourself at Safer Than Home LakmÃ© Salon   us on    to prebook your appointment  DefinetoRedefine FDCIxLFW FDCIxLakmeFashionWeek LakmeFashionWeek TheAwakening Chola CholabySohayaMisra LakmeSalon LakmeSalonXChola 
209,AwakenYourFestiveSpirit with a moonlike glow this Karwa Chauth   Dazzle your main man with the HD Airbrush Makeup Look  Pay K  get services worth K at your favourite SaferThanHome LakmÃ© Salon   Avail the best of offers beauty and safety with  precautions that ensure modernday application modernday airbrush technique no direct contact and fast  lasting execution with onetime use brushes    us on    to prebook your appointment  Certified Safer Than Home based on a survey amongst  customers  LakmeSalon KarwaChauth MagicMoments BackstageHeroes SaferThanHome Inspiring BehindTheScenes SalonExperts RevampYourLook HappyHair HappyTresses HairColor HairTransformation HairColorInspiration BookYourAppointment FlauntYourStyle HairCare Nourish Shine ShadesOfSpice Schwarzkopf ,en,AwakenYourFestiveSpirit with a moonlike glow this Karwa Chauth   Dazzle your main man with the HD Airbrush Makeup Look  Pay K  get services worth K at your favourite SaferThanHome LakmÃ© Salon   Avail the best of offers beauty and safety with  precautions that ensure modernday application modernday airbrush technique no direct contact and fast  lasting execution with onetime use brushes    us on    to prebook your appointment  Certified Safer Than Home based on a survey amongst  customers  LakmeSalon KarwaChauth MagicMoments BackstageHeroes SaferThanHome Inspiring BehindTheScenes SalonExperts RevampYourLook HappyHair HappyTresses HairColor HairTransformation HairColorInspiration BookYourAppointment FlauntYourStyle HairCare Nourish Shine ShadesOfSpice Schwarzkopf 
210,LakmeSalonXWedMeGood  When the big fat Indian wedding is the stuff of your dreams your look must be nothing short of breathtaking   Bambai Nagariya ki GenNextBrides come on over to LakmÃ© Salon to avail special offers for a showstopping bridal makeover    us on    to prebook your appointment  LakmeSalon GenNextBride SaferThanHome BackstageHeroes Showstoppers InternationalBrands ExpertServices TrendiestServices LakmeFashionWeek SalonExperts Makeup Bridesmaid PartyMakeup BrideSquad Brides WeddingGoals BridesOfIndia BrideGoals IndianWedding IndianBrides ,en,LakmeSalonXWedMeGood  When the big fat Indian wedding is the stuff of your dreams your look must be nothing short of breathtaking   Bambai Nagariya ki GenNextBrides come on over to LakmÃ© Salon to avail special offers for a showstopping bridal makeover    us on    to prebook your appointment  LakmeSalon GenNextBride SaferThanHome BackstageHeroes Showstoppers InternationalBrands ExpertServices TrendiestServices LakmeFashionWeek SalonExperts Makeup Bridesmaid PartyMakeup BrideSquad Brides WeddingGoals BridesOfIndia BrideGoals IndianWedding IndianBrides 
211,LakmeSalonXWedMeGood  A marvellous Mughal bride dons herself in a beautiful lehenga and completes the look with the perfect Paasa This evergreen traditional look from Lucknow has our heart   This bride makes the most of nude undertones for a look that seems natural yet effortlessly elegant With glassglow skin bronze contour and perfectly arched eyebrows this look perfectly accentuates her features Winged liner and pink eyeshadow add a softness to her look while the nude lipcolor helps her smile stand out Her freeflowing hair and walnut global highlights balance her look with grace   Lucknowi bridestobe you can now visit our lakmesalonlucknow in Vivek Khand Gomti Nagar or avail a virtual bridal consultation with our experts from the comfort and safety of your home Visit the link URL and enter your details with preferred time  date Thats all the assistance you need to find the perfect bridal look for yourself  LakmeSalon GenNextBride SaferThanHome BackstageHeroes Showstoppers InternationalBrands ExpertServices TrendiestServices LakmeFashionWeek SalonExperts Makeup Bridesmaid PartyMakeup BrideSquad Brides WeddingGoals BridesOfIndia BrideGoals IndianWedding IndianBrides ,en,LakmeSalonXWedMeGood  A marvellous Mughal bride dons herself in a beautiful lehenga and completes the look with the perfect Paasa This evergreen traditional look from Lucknow has our heart   This bride makes the most of nude undertones for a look that seems natural yet effortlessly elegant With glassglow skin bronze contour and perfectly arched eyebrows this look perfectly accentuates her features Winged liner and pink eyeshadow add a softness to her look while the nude lipcolor helps her smile stand out Her freeflowing hair and walnut global highlights balance her look with grace   Lucknowi bridestobe you can now visit our lakmesalonlucknow in Vivek Khand Gomti Nagar or avail a virtual bridal consultation with our experts from the comfort and safety of your home Visit the link URL and enter your details with preferred time  date Thats all the assistance you need to find the perfect bridal look for yourself  LakmeSalon GenNextBride SaferThanHome BackstageHeroes Showstoppers InternationalBrands ExpertServices TrendiestServices LakmeFashionWeek SalonExperts Makeup Bridesmaid PartyMakeup BrideSquad Brides WeddingGoals BridesOfIndia BrideGoals IndianWedding IndianBrides 
212,LakmeSalonXWedMeGood  When your lehenga is contemporary with jewelry that looks khandaani its obvious that youre a Lucknowi GenNextBride   With a peachy glow that complements her outfit this bride is all about her eyes  smoldering smokey eyes a pretty pink crease and mink lashes Her pink lips and Maang Tikka make this look the perfect balance between playful and traditional To further accentuate this playfulness her hair is freeflowing in a half bun adorned with angels breath to keep it simple yet stunning   Lucknowi bridestobe you can now visit our lakmesalonlucknow in Vivek Khand Gomti Nagar or avail a virtual bridal consultation with our experts from the comfort and safety of your home Visit the link URL and enter your details with preferred time  date Thats all the assistance you need to find the perfect bridal look for yourself  LakmeSalon GenNextBride SaferThanHome BackstageHeroes Showstoppers InternationalBrands ExpertServices TrendiestServices LakmeFashionWeek SalonExperts Makeup Bridesmaid PartyMakeup BrideSquad Brides WeddingGoals BridesOfIndia BrideGoals IndianWedding IndianBrides ,en,LakmeSalonXWedMeGood  When your lehenga is contemporary with jewelry that looks khandaani its obvious that youre a Lucknowi GenNextBride   With a peachy glow that complements her outfit this bride is all about her eyes  smoldering smokey eyes a pretty pink crease and mink lashes Her pink lips and Maang Tikka make this look the perfect balance between playful and traditional To further accentuate this playfulness her hair is freeflowing in a half bun adorned with angels breath to keep it simple yet stunning   Lucknowi bridestobe you can now visit our lakmesalonlucknow in Vivek Khand Gomti Nagar or avail a virtual bridal consultation with our experts from the comfort and safety of your home Visit the link URL and enter your details with preferred time  date Thats all the assistance you need to find the perfect bridal look for yourself  LakmeSalon GenNextBride SaferThanHome BackstageHeroes Showstoppers InternationalBrands ExpertServices TrendiestServices LakmeFashionWeek SalonExperts Makeup Bridesmaid PartyMakeup BrideSquad Brides WeddingGoals BridesOfIndia BrideGoals IndianWedding IndianBrides 
213,MagicMoments  A lavender ensemble with a peachy glow wavy locks  smouldering eyes is the ideal way to indulge in the festivities   AwakenYourFestiveSpirit with a breathtaking makeover by our expert Shalika at lakmesalonkidwainagar   us on    to book an appointment  LakmeSalon MagicMoments BackstageHeroes SaferThanHome Inspiring BehindTheScenes SalonExperts RevampYourLook HappyHair HappyTresses HairColor HairTransformation HairColorInspiration BookYourAppointment FlauntYourStyle HairCare Nourish Shine ShadesOfSpice Schwarzkopf ,en,MagicMoments  A lavender ensemble with a peachy glow wavy locks  smouldering eyes is the ideal way to indulge in the festivities   AwakenYourFestiveSpirit with a breathtaking makeover by our expert Shalika at lakmesalonkidwainagar   us on    to book an appointment  LakmeSalon MagicMoments BackstageHeroes SaferThanHome Inspiring BehindTheScenes SalonExperts RevampYourLook HappyHair HappyTresses HairColor HairTransformation HairColorInspiration BookYourAppointment FlauntYourStyle HairCare Nourish Shine ShadesOfSpice Schwarzkopf 
214,I want to share with you guyzz my all time fav brands products lakmeindia Check out this video In this video u will find out best foundation primer sheer compact these products are really amazing I am using from last  years  extremely happy with these products they are magic for best makeup no makeup look you should try at once Thankyou so much mynykaa for your service Your fast delivery service are amazing   lakmefoundationsheerprimercompactmakeupnomakeuplookigtvnykaanykaafashionnykaacosmeticsnykaindialakmeabsolutelakmecosmeticslakmeproductshasnainskitchen ,en,I want to share with you guyzz my all time fav brands products lakmeindia Check out this video In this video u will find out best foundation primer sheer compact these products are really amazing I am using from last  years  extremely happy with these products they are magic for best makeup no makeup look you should try at once Thankyou so much mynykaa for your service Your fast delivery service are amazing   lakmefoundationsheerprimercompactmakeupnomakeuplookigtvnykaanykaafashionnykaacosmeticsnykaindialakmeabsolutelakmecosmeticslakmeproductshasnainskitchen 
215,AwakenYourFestiveSpirit with services worth K at K only   Visit your favourite Safer Than Home LakmÃ© Salon to avail the best of offers beauty and safety with  precautions to look your best with perfect hair makeup nails and everything else    us on    to prebook your appointment  Certified Safer Than Home based on a survey amongst  customers  Limited Period Offer until th of November  LakmeSalon Festive MagicMoments BackstageHeroes SaferThanHome Inspiring BehindTheScenes SalonExperts RevampYourLook HappyHair HappyTresses HairColor HairTransformation HairColorInspiration BookYourAppointment FlauntYourStyle HairCare Nourish Shine ShadesOfSpice Schwarzkopf ,en,AwakenYourFestiveSpirit with services worth K at K only   Visit your favourite Safer Than Home LakmÃ© Salon to avail the best of offers beauty and safety with  precautions to look your best with perfect hair makeup nails and everything else    us on    to prebook your appointment  Certified Safer Than Home based on a survey amongst  customers  Limited Period Offer until th of November  LakmeSalon Festive MagicMoments BackstageHeroes SaferThanHome Inspiring BehindTheScenes SalonExperts RevampYourLook HappyHair HappyTresses HairColor HairTransformation HairColorInspiration BookYourAppointment FlauntYourStyle HairCare Nourish Shine ShadesOfSpice Schwarzkopf 
216,This Karwa Chauth feel like a bride again with a look that will make him keep looking  LakmÃ© Salon family wishes you a stunning KarwaChauth   AwakenYourFestiveSpirit with our exciting festive offers available at your nearest Safer Than Home LakmÃ© Salon Pay   avail services worth  for a look that is just priceless     on    to prebook your appointment  Certified Safer Than Home based on a survey amongst  customers  LakmeSalon KarwaChauth MagicMoments BackstageHeroes SaferThanHome Inspiring BehindTheScenes SalonExperts RevampYourLook HappyHair HappyTresses HairColor HairTransformation HairColorInspiration BookYourAppointment FlauntYourStyle HairCare Nourish Shine ShadesOfSpice Schwarzkopf ,en,This Karwa Chauth feel like a bride again with a look that will make him keep looking  LakmÃ© Salon family wishes you a stunning KarwaChauth   AwakenYourFestiveSpirit with our exciting festive offers available at your nearest Safer Than Home LakmÃ© Salon Pay   avail services worth  for a look that is just priceless     on    to prebook your appointment  Certified Safer Than Home based on a survey amongst  customers  LakmeSalon KarwaChauth MagicMoments BackstageHeroes SaferThanHome Inspiring BehindTheScenes SalonExperts RevampYourLook HappyHair HappyTresses HairColor HairTransformation HairColorInspiration BookYourAppointment FlauntYourStyle HairCare Nourish Shine ShadesOfSpice Schwarzkopf 
217,Glow more than the moon this Karwa Chauth  Swipe to see all the steps   Describe your Karwa Chauth look in the comments and we will tell you how to get it   Visit your nearest Safer Than Home LakmÃ© Salon to get your own special look Pay   avail services worth   for a look that is just priceless   Call us on    to prebook your appointment  Certified Safer Than Home based on a survey amongst  customers  LakmeSalon KarwaChauth MagicMoments BackstageHeroes SaferThanHome Inspiring BehindTheScenes SalonExperts RevampYourLook HappyHair HappyTresses HairColor HairTransformation HairColorInspiration BookYourAppointment FlauntYourStyle HairCare Nourish Shine ShadesOfSpice Schwarzkopf ,en,Glow more than the moon this Karwa Chauth  Swipe to see all the steps   Describe your Karwa Chauth look in the comments and we will tell you how to get it   Visit your nearest Safer Than Home LakmÃ© Salon to get your own special look Pay   avail services worth   for a look that is just priceless   Call us on    to prebook your appointment  Certified Safer Than Home based on a survey amongst  customers  LakmeSalon KarwaChauth MagicMoments BackstageHeroes SaferThanHome Inspiring BehindTheScenes SalonExperts RevampYourLook HappyHair HappyTresses HairColor HairTransformation HairColorInspiration BookYourAppointment FlauntYourStyle HairCare Nourish Shine ShadesOfSpice Schwarzkopf 
218,LakmeSalonXWedMeGood  When passas and lehengas are all you love you know you are a Lucknowi desi girl at heart GenNextBrides make your traditional look pictureperfect with LakmÃ© Salons special bridal offers    us on    to prebook your appointment   LakmeSalon GenNextBride SaferThanHome BackstageHeroes Showstoppers InternationalBrands ExpertServices TrendiestServices LakmeFashionWeek SalonExperts Makeup Bridesmaid PartyMakeup BrideSquad Brides WeddingGoals BridesOfIndia BrideGoals IndianWedding IndianBrides ,en,LakmeSalonXWedMeGood  When passas and lehengas are all you love you know you are a Lucknowi desi girl at heart GenNextBrides make your traditional look pictureperfect with LakmÃ© Salons special bridal offers    us on    to prebook your appointment   LakmeSalon GenNextBride SaferThanHome BackstageHeroes Showstoppers InternationalBrands ExpertServices TrendiestServices LakmeFashionWeek SalonExperts Makeup Bridesmaid PartyMakeup BrideSquad Brides WeddingGoals BridesOfIndia BrideGoals IndianWedding IndianBrides 
219,Repost  meerabhojani  So happy to be a part of TheAwakening by LakmÃ© Salon x Chola Celebrating the art of letting go with my new hair color so glad to see it turned out just the way I wanted Go book you appointments lakmesalon lakme_salon_goregaoneast to get the perfect hair this season   Awaken your festive spirit and visit your nearest LakmÃ© Salon to get a dreamy makeover   LakmeSalon ColoursOfFreedom MagicMoments BackstageHeroes SaferThanHome Inspiring BehindTheScenes SalonExperts RevampYourLook HappyHair HappyTresses HairColor HairTransformation HairColorInspiration BookYourAppointment FlauntYourStyle HairCare Nourish Shine ShadesOfSpice Schwarzkopf ,en,Repost  meerabhojani  So happy to be a part of TheAwakening by LakmÃ© Salon x Chola Celebrating the art of letting go with my new hair color so glad to see it turned out just the way I wanted Go book you appointments lakmesalon lakme_salon_goregaoneast to get the perfect hair this season   Awaken your festive spirit and visit your nearest LakmÃ© Salon to get a dreamy makeover   LakmeSalon ColoursOfFreedom MagicMoments BackstageHeroes SaferThanHome Inspiring BehindTheScenes SalonExperts RevampYourLook HappyHair HappyTresses HairColor HairTransformation HairColorInspiration BookYourAppointment FlauntYourStyle HairCare Nourish Shine ShadesOfSpice Schwarzkopf 
220,ZakaÅ¾ite termin na vremenaÅ¡a ponuda tretmana nege kose je Å¡iroka i dostupna  A mi smo tu za vas          aura aurahair iplex lakmecosmetics lakmelovers lakmÃ© auralakmÃ© iplexlakme hairhair hairlife salonprofessional hairprofessional ,hr,
221,AwakenYourFestiveSpirit  Be the life of the party  light up this Diwali with LakmÃ© Salons Party Pataka looks  Swipe to see all the steps to follow  Drop a  below if these looks left you awestruck  visit your nearest Safer Than Home LakmÃ© Salon to get your own Party Pataka look Pay   avail services worth  for a look that is just priceless    on    to prebook your appointment  Certified Safer Than Home based on a survey amongst  customers  LakmeSalon PartyLook MagicMoments BackstageHeroes SaferThanHome Inspiring BehindTheScenes SalonExperts RevampYourLook HappyHair HappyTresses HairColor HairTransformation HairColorInspiration BookYourAppointment FlauntYourStyle HairCare Nourish Shine ShadesOfSpice Schwarzkopf ,en,AwakenYourFestiveSpirit  Be the life of the party  light up this Diwali with LakmÃ© Salons Party Pataka looks  Swipe to see all the steps to follow  Drop a  below if these looks left you awestruck  visit your nearest Safer Than Home LakmÃ© Salon to get your own Party Pataka look Pay   avail services worth  for a look that is just priceless    on    to prebook your appointment  Certified Safer Than Home based on a survey amongst  customers  LakmeSalon PartyLook MagicMoments BackstageHeroes SaferThanHome Inspiring BehindTheScenes SalonExperts RevampYourLook HappyHair HappyTresses HairColor HairTransformation HairColorInspiration BookYourAppointment FlauntYourStyle HairCare Nourish Shine ShadesOfSpice Schwarzkopf 
222,Short and sudden trips are lovely travelling traveljaipur heritageofjaipur jaipurcity lakmecosmetics earringslover examtrips ,en,Short and sudden trips are lovely travelling traveljaipur heritageofjaipur jaipurcity lakmecosmetics earringslover examtrips 
223,YesI am obsessed with the colour white   in_insta  throwback panchami durgapujadiaries durgapuja panchamilook whitedress pearlsdupatta oxidizedjewellery danglerearrings kikomilanomakeup lakmecosmetics sephora maybelline whiteoutfit anarkalisuits picoftheday ,en,YesI am obsessed with the colour white   in_insta  throwback panchami durgapujadiaries durgapuja panchamilook whitedress pearlsdupatta oxidizedjewellery danglerearrings kikomilanomakeup lakmecosmetics sephora maybelline whiteoutfit anarkalisuits picoftheday 
224,AwakenYourFestiveSpirit with  off on purchase of  services offers you cant say no to  celebrate in style   Celebrate in style with offers you cant say no to at Safer Than Home LakmÃ© Salon Avail the best of offers beauty and safety with  precautions that ensure you look your best at every occasion    us on    to prebook your appointment  Certified Safer Than Home based on a survey amongst  customers  Limited Period Offer until th of November  LakmeSalon Festive MagicMoments BackstageHeroes SaferThanHome Inspiring BehindTheScenes SalonExperts RevampYourLook HappyHair HappyTresses HairColor HairTransformation HairColorInspiration BookYourAppointment FlauntYourStyle HairCare Nourish Shine ShadesOfSpice Schwarzkopf ,en,AwakenYourFestiveSpirit with  off on purchase of  services offers you cant say no to  celebrate in style   Celebrate in style with offers you cant say no to at Safer Than Home LakmÃ© Salon Avail the best of offers beauty and safety with  precautions that ensure you look your best at every occasion    us on    to prebook your appointment  Certified Safer Than Home based on a survey amongst  customers  Limited Period Offer until th of November  LakmeSalon Festive MagicMoments BackstageHeroes SaferThanHome Inspiring BehindTheScenes SalonExperts RevampYourLook HappyHair HappyTresses HairColor HairTransformation HairColorInspiration BookYourAppointment FlauntYourStyle HairCare Nourish Shine ShadesOfSpice Schwarzkopf 
225,AwakenYourFestiveSpirit   Shine brighter than a pataka this Diwali with LakmÃ© Salons dazzling looks   Swipe to see all the steps to follow  Describe your favorite festive look in the comments and we will tell you how to get it   Visit your nearest Safer Than Home LakmÃ© Salon to get your own delightful Diwali look Pay   avail services worth  for a look that is just priceless    on    to prebook your appointment  Certified Safer Than Home based on a survey amongst  customers  LakmeSalon Diwali MagicMoments BackstageHeroes SaferThanHome Inspiring BehindTheScenes SalonExperts RevampYourLook HappyHair HappyTresses HairColor HairTransformation HairColorInspiration BookYourAppointment FlauntYourStyle HairCare Nourish Shine ShadesOfSpice Schwarzkopf ,en,AwakenYourFestiveSpirit   Shine brighter than a pataka this Diwali with LakmÃ© Salons dazzling looks   Swipe to see all the steps to follow  Describe your favorite festive look in the comments and we will tell you how to get it   Visit your nearest Safer Than Home LakmÃ© Salon to get your own delightful Diwali look Pay   avail services worth  for a look that is just priceless    on    to prebook your appointment  Certified Safer Than Home based on a survey amongst  customers  LakmeSalon Diwali MagicMoments BackstageHeroes SaferThanHome Inspiring BehindTheScenes SalonExperts RevampYourLook HappyHair HappyTresses HairColor HairTransformation HairColorInspiration BookYourAppointment FlauntYourStyle HairCare Nourish Shine ShadesOfSpice Schwarzkopf 
226,AwakenYourFestiveSpirit with the gift of beauty for you and your loved ones Add glamour to the festivities with LakmÃ© Salons eGift Cards  Visit our website to book eGift Cards starting at Rs  only Drop by at your favourite Safer Than Home LakmÃ© Salon to get the best of beauty  safety with  precautions Charm your way through the celebrations with dreamy looks   Certified Safer Than Home based on a survey amongst  customers  LakmeSalon Gift MagicMoments BackstageHeroes SaferThanHome Inspiring BehindTheScenes SalonExperts RevampYourLook HappyHair HappyTresses HairColor HairTransformation HairColorInspiration BookYourAppointment FlauntYourStyle HairCare Nourish Shine ShadesOfSpice Schwarzkopf ,en,AwakenYourFestiveSpirit with the gift of beauty for you and your loved ones Add glamour to the festivities with LakmÃ© Salons eGift Cards  Visit our website to book eGift Cards starting at Rs  only Drop by at your favourite Safer Than Home LakmÃ© Salon to get the best of beauty  safety with  precautions Charm your way through the celebrations with dreamy looks   Certified Safer Than Home based on a survey amongst  customers  LakmeSalon Gift MagicMoments BackstageHeroes SaferThanHome Inspiring BehindTheScenes SalonExperts RevampYourLook HappyHair HappyTresses HairColor HairTransformation HairColorInspiration BookYourAppointment FlauntYourStyle HairCare Nourish Shine ShadesOfSpice Schwarzkopf 
