,Text,language,english
0,durgapuja durgapujainusa durgamaa saree sareelover sareedraping sareelovers sareeindia sareestyle sareeblouse makeup makeuplover makeupaddict makeupjunkie beautymakeup beautyjunkie beautyaddict beautyproducts beautycommunity beautyblog beautygram lakmecosmetics lakmeabsolute lakmeproducts ,af,
1,Lakme  To  Natural  CC Cream  Color Bronze Its With Pure Aloe Vera  SPF  PA Real Price  From Nykaa   Hello Cuties Must Buy This Lakme  to  CC Cream   Its Give Full Flawless Coverage  Fragrance Is Very Nice   For Daily Office Work Its Very Affordable  Nourish Your Skin With SPF  PA   lakmeindia nykaabeauty mynykaa  Watch Full Video On Our YouTube Channel Link In Bio   Hello Folks Welcome To elite_makeup_junkie   Elite_MakeUp_Junkie Lakme LakmeBeautyLooks LakmeTo LakmeAbsolute LakmeFashionWeek LakmeMousse LakmeCCCream ILakme LakmeSalon LakmeProducts LakmeFashion LakmeMakeup LakmeCosmetics LakmeBeauty GetItWithLumi LakmeIndia  India PageOfAds Page_Of_Ads Nykaa Myntra Amazon FlipKart LetsPurplle IndianBeautyBlogger Beauty BeautyBlogger Influencer MakeUp ,en,Lakme  To  Natural  CC Cream  Color Bronze Its With Pure Aloe Vera  SPF  PA Real Price  From Nykaa   Hello Cuties Must Buy This Lakme  to  CC Cream   Its Give Full Flawless Coverage  Fragrance Is Very Nice   For Daily Office Work Its Very Affordable  Nourish Your Skin With SPF  PA   lakmeindia nykaabeauty mynykaa  Watch Full Video On Our YouTube Channel Link In Bio   Hello Folks Welcome To elite_makeup_junkie   Elite_MakeUp_Junkie Lakme LakmeBeautyLooks LakmeTo LakmeAbsolute LakmeFashionWeek LakmeMousse LakmeCCCream ILakme LakmeSalon LakmeProducts LakmeFashion LakmeMakeup LakmeCosmetics LakmeBeauty GetItWithLumi LakmeIndia  India PageOfAds Page_Of_Ads Nykaa Myntra Amazon FlipKart LetsPurplle IndianBeautyBlogger Beauty BeautyBlogger Influencer MakeUp 
2,Get your hands on your favourite product of Lakme at half of its actual amount only at The Beauty Shop or call us now Grab this once in a lifetime offer of  off now  Lakme TheBeautyShop LakmeGel LakmeCosmetics LakmeProducts Offer Discount WideRangeOfProducts LakmeIndia SkinCare Makeup MakeupProducts ,en,Get your hands on your favourite product of Lakme at half of its actual amount only at The Beauty Shop or call us now Grab this once in a lifetime offer of  off now  Lakme TheBeautyShop LakmeGel LakmeCosmetics LakmeProducts Offer Discount WideRangeOfProducts LakmeIndia SkinCare Makeup MakeupProducts 
3,niveaindia Nivea moisturizer  swissbeautycosmetics Swiss beauty compact powder concealer  nybae  nybae contour  blueheavencosmetics  Blue heaven primer  glamcosmetic  glam highlighter  glamcosmetic  glam New Lipstick pink shade   blueheavencosmetics  blue heaven eyebrows definer  lakmeindia  Lakme to bb cream  good_vibesin  good vibes tea tree toner  swissbeautycosmeticsblueheavenglamcosmeticslakmelipsticklakmecosmeticsniveagoodvibesskincareproductseyemakeuptutorial weddingmakeup ,en,niveaindia Nivea moisturizer  swissbeautycosmetics Swiss beauty compact powder concealer  nybae  nybae contour  blueheavencosmetics  Blue heaven primer  glamcosmetic  glam highlighter  glamcosmetic  glam New Lipstick pink shade   blueheavencosmetics  blue heaven eyebrows definer  lakmeindia  Lakme to bb cream  good_vibesin  good vibes tea tree toner  swissbeautycosmeticsblueheavenglamcosmeticslakmelipsticklakmecosmeticsniveagoodvibesskincareproductseyemakeuptutorial weddingmakeup 
4,Natural Makeup       jahnavi_     teamperfectframes     makeupbynishta    makeupbyzainabfaiz hair  southindianweddings southindianbride explorepage explore exploremore trending transition tuesday tuesdaytransformation muasupport mualife subtlemakeup lipstick curlshair southindianhairstyle indianbride wedmegoodsouth wedmegood wedding maccosmetics paccosmetics makeuprevolution hudabeauty lakmecosmetics maybelline nykaabeautybook colorbar trysugar rudecosmetics wakeupandmakeup ,en,Natural Makeup       jahnavi_     teamperfectframes     makeupbynishta    makeupbyzainabfaiz hair  southindianweddings southindianbride explorepage explore exploremore trending transition tuesday tuesdaytransformation muasupport mualife subtlemakeup lipstick curlshair southindianhairstyle indianbride wedmegoodsouth wedmegood wedding maccosmetics paccosmetics makeuprevolution hudabeauty lakmecosmetics maybelline nykaabeautybook colorbar trysugar rudecosmetics wakeupandmakeup 
5,    haircutvideo hairinsta lakmesalon lakmecolour lakmecosmetics lakmesilver lakmepearl lakmecollage chromalakme glosslakme oyster oystercolor toner tonercollagen tonercolor blondie brownie red bluelakmesilver ,en,    haircutvideo hairinsta lakmesalon lakmecolour lakmecosmetics lakmesilver lakmepearl lakmecollage chromalakme glosslakme oyster oystercolor toner tonercollagen tonercolor blondie brownie red bluelakmesilver 
6,Client Feedback  product  Sequences Pillow      Thankyou  so much  For choosing us  We are glad to serve you  Keep shopping   Keep supporting  _beingcreative western_indian_fashion wedding_lehenga_jewellery   sequencepillow magicpillow makeuplovers pillow trendinggifts customisedgifts casualgifts birthdaygiftsforher lakmecombo hudabeautycombo lakmecosmetics giftyshop magicmug pillowthoughts maccombo girlyfashion heartpillow pillowfordecoration pillowforroom hangingpillow heartpillows trendingfashion hangcousins maccosmetics fashion sequencepearl roadfashion chocolatelovers cushion _beingcreative ,en,Client Feedback  product  Sequences Pillow      Thankyou  so much  For choosing us  We are glad to serve you  Keep shopping   Keep supporting  _beingcreative western_indian_fashion wedding_lehenga_jewellery   sequencepillow magicpillow makeuplovers pillow trendinggifts customisedgifts casualgifts birthdaygiftsforher lakmecombo hudabeautycombo lakmecosmetics giftyshop magicmug pillowthoughts maccombo girlyfashion heartpillow pillowfordecoration pillowforroom hangingpillow heartpillows trendingfashion hangcousins maccosmetics fashion sequencepearl roadfashion chocolatelovers cushion _beingcreative 
7,  FOR MORE FOLLOW vr_beautybliss_   BROW wetnwildindia   EYE lakmeindia absolute infinity eye shadow palette  lakmeindia eyeconic kajal  regal green lakmeindia  to  complexion  cc cream   greeneye greenmakeup makeup lakmecccream makeupoftheday fridaymakeup shadoweye eyeshadow lakme lakmekajal lakmecosmetics wetnwild vrbeautybliss ,en,  FOR MORE FOLLOW vr_beautybliss_   BROW wetnwildindia   EYE lakmeindia absolute infinity eye shadow palette  lakmeindia eyeconic kajal  regal green lakmeindia  to  complexion  cc cream   greeneye greenmakeup makeup lakmecccream makeupoftheday fridaymakeup shadoweye eyeshadow lakme lakmekajal lakmecosmetics wetnwild vrbeautybliss 
8,Glam festive makeup I tried this look with mebelline fit me as a foundation  Benifits of the foundation it is matte foundation have a very smooth application it is having a high blendibility matches well with my skintone cost effective  Demerits dry very quicklyapply moisturizer before the application  I used mebelline gel eyeliner  Benifits have a bright black pigment have a stying power of  to  hours less smudge action easy appication  Lipstick I use lakme lipstick in crushed caramel shade  Benifits matte finish comfortable in lips  unique colour shade staying power to  hours lakmecosmetics lakmelipstick mebellineeyelinerfestivemakeupsareelove ,en,Glam festive makeup I tried this look with mebelline fit me as a foundation  Benifits of the foundation it is matte foundation have a very smooth application it is having a high blendibility matches well with my skintone cost effective  Demerits dry very quicklyapply moisturizer before the application  I used mebelline gel eyeliner  Benifits have a bright black pigment have a stying power of  to  hours less smudge action easy appication  Lipstick I use lakme lipstick in crushed caramel shade  Benifits matte finish comfortable in lips  unique colour shade staying power to  hours lakmecosmetics lakmelipstick mebellineeyelinerfestivemakeupsareelove 
9,When my bro riz_roxx gave me only mins to dress up  riz_roxx   blackoutfit blackoutfit sundayvibes sunday sundayouting cafe blackdress ootd simplicity lakmecosmetics maybelline missclairecosmetics nyxcosmetics sephora picoftheday lookoftheday instafit instagood instadaily instamood instagram ,en,When my bro riz_roxx gave me only mins to dress up  riz_roxx   blackoutfit blackoutfit sundayvibes sunday sundayouting cafe blackdress ootd simplicity lakmecosmetics maybelline missclairecosmetics nyxcosmetics sephora picoftheday lookoftheday instafit instagood instadaily instamood instagram 
10,Give yourself the perfect kickstart into the monsoon season with a Lakme look Have a collection of your own   To shop online visit our BIO  Kathiawar KathiawarStores Lakme LakmeCosmetics Cosmetics beauty shopping OnlineShopping ShopOnline Sale ExcitingOffers ,en,Give yourself the perfect kickstart into the monsoon season with a Lakme look Have a collection of your own   To shop online visit our BIO  Kathiawar KathiawarStores Lakme LakmeCosmetics Cosmetics beauty shopping OnlineShopping ShopOnline Sale ExcitingOffers 
11,Lakme lip crayons  piece set in stock   Full box at just Rs  only    original at a very reasonable prices   We worth ur trust   Dm me for order and query please    Payment mode  Paytm banktransfer UPI phonepay cod available on order above the   lakmelipstick lakmemakeup bestlipcrayons originalproduct bestmakeupproducts lakmecosmetics bestlipstick perfctlook makeupoftheday nailextensions ,en,Lakme lip crayons  piece set in stock   Full box at just Rs  only    original at a very reasonable prices   We worth ur trust   Dm me for order and query please    Payment mode  Paytm banktransfer UPI phonepay cod available on order above the   lakmelipstick lakmemakeup bestlipcrayons originalproduct bestmakeupproducts lakmecosmetics bestlipstick perfctlook makeupoftheday nailextensions 
12,Glam look by using mangtika only  This bold eye look with pink lips and large mangtika is perfect to carry it in any festive occasion or any social function  I did my eyebrow with mebellineeyeliner and my eyeliner is also from mebellineeyeliner  I applied blush from lakme lipstic i used is from lakme mousse lipstick   festival mangtikka lakmecosmetics glamfestive partylook partylookmakeup occationalwear pink pinklipstick ,en,Glam look by using mangtika only  This bold eye look with pink lips and large mangtika is perfect to carry it in any festive occasion or any social function  I did my eyebrow with mebellineeyeliner and my eyeliner is also from mebellineeyeliner  I applied blush from lakme lipstic i used is from lakme mousse lipstick   festival mangtikka lakmecosmetics glamfestive partylook partylookmakeup occationalwear pink pinklipstick 
13,Rs Only in Lakme Powder Foundation  Concealer Compact      lakmefashionweek lakmepowderfoundation lakmeconcealer lakmecompactpowder lakmecosmetics lakmeproducts makeupproducts makeupstore reasonableprice trending explorepage onlinemakeupstore onlinecosmeticsshopping ,en,Rs Only in Lakme Powder Foundation  Concealer Compact      lakmefashionweek lakmepowderfoundation lakmeconcealer lakmecompactpowder lakmecosmetics lakmeproducts makeupproducts makeupstore reasonableprice trending explorepage onlinemakeupstore onlinecosmeticsshopping 
14,party_makeupmakeovers easy_party_lookfacescanadacosmeticssugarcosmeticskryolancosmetics myglammcosmeticslakmecosmetics  facescanda reeldaily dailyreels instagoods modelshoot likeforlikes followforlikes likeforback followforback followforbackfollow lovemakeup makeupartistsworldwide reelsinstagram instareels vahvahstudents learnwithvahvah vahvahmuas  PRODUCT DETAILS  Ultimepro primer facescanada Ultimepro second skin foundationfacescanada  Lipstickmyglamm Makeup fixerfacescanada Stick blushfacescanada Ultimepro kajalfacescanada Pen eyelinerfacescanada Mascarafacescanada Concealerkryolan Facepowdersugar Blushkryolan Concealerkryolan Lipsticklakme Lipstickmyglamm vahvahmakeup facescanada myglamm lakmeindia kryolanofficial trysugar  Model pritz_  Thanks for watching  ,id,
15,There is a shade of brown for every woman and mix it with smokey eyes  youll feel more glamour in your face   lakmeindia lakmeeyeconickajal lakmecosmetics lakmesalon smokeyeyes makeupblog instagrammakeup makeupbrand makeupartist makeuppost photoshoot photography artist artistofinstagram makeupartist ,en,There is a shade of brown for every woman and mix it with smokey eyes  youll feel more glamour in your face   lakmeindia lakmeeyeconickajal lakmecosmetics lakmesalon smokeyeyes makeupblog instagrammakeup makeupbrand makeupartist makeuppost photoshoot photography artist artistofinstagram makeupartist 
16,Try casual looklonghairstyles contentcreator blogger pune punecity punenaturelovers puneblogger anddresses shopersstop kotacity kotarajasthan fashionblogger bluelover maccosmetics lakmecosmetics blogger maxidress photoshoot photography photographylovers ,en,Try casual looklonghairstyles contentcreator blogger pune punecity punenaturelovers puneblogger anddresses shopersstop kotacity kotarajasthan fashionblogger bluelover maccosmetics lakmecosmetics blogger maxidress photoshoot photography photographylovers 
17,Om mooie blonde lokken te behouden zal je regelmatig gebruik moeten maken van een toning shampoo of masker De LakmÃ© White Silver lijn is perfect om jouw gele tinten uit het haar te laten verdwijnen Daarnaast is deze lijn sustainable Dus niet alleen goed voor je haar maar ook voor onze aarde  hairactionnl hairaction lakmecosmetics lakme hairproducts ,nl,
18, _Combo _     Beauty Glazed Color Studio Eyeshadow Pallete Mac Face n Body Foundation Mac Bottle Primer LA Pro Concealer Fenty Beauty Lipgloss Luxury Stoned Nails Huda Beauty Makeup Remover Mac Makeup Fixer Eyelash hudabeauty Beauty Compact Nailpaint mackajalcrayon   _Price Just rs shipping free_    makeup makeupproducts onlineshopping onlinemakeupstore macproducts hudabeauty lakmecosmetics macmascara lipstick eyeshadowpalette primer compactpowder sale indianbusiness indianmakeupandbeauty beauty likelikes follow explorepage trending share ,en, _Combo _     Beauty Glazed Color Studio Eyeshadow Pallete Mac Face n Body Foundation Mac Bottle Primer LA Pro Concealer Fenty Beauty Lipgloss Luxury Stoned Nails Huda Beauty Makeup Remover Mac Makeup Fixer Eyelash hudabeauty Beauty Compact Nailpaint mackajalcrayon   _Price Just rs shipping free_    makeup makeupproducts onlineshopping onlinemakeupstore macproducts hudabeauty lakmecosmetics macmascara lipstick eyeshadowpalette primer compactpowder sale indianbusiness indianmakeupandbeauty beauty likelikes follow explorepage trending share 
19,ğŠğƒğğšğ¥ğ¬ ğ‰ğ®ğ¥ğ²   Hai Kotty Girls Lengkapi kebahagiaanmu dengan shopping cantik di Kotty Kosmetik   BUY  GET  Selected Item for Lakme Periode  Juli  Berlaku Offline dan Online  Kamu juga bisa nyalakan lonceng notifikasi Instagram Kotty Kosmetik dan favoritkan Toko Kotty Kosmetik di shopee supaya nggak ketinggalan info promo menarik lainnya ya  ğ™ğ™ğ™¤ğ™¥ğ™šğ™š  ğ—ğ—¼ğ˜ğ˜ğ˜† ğ—ğ—¼ğ˜€ğ—ºğ—²ğ˜ğ—¶ğ—¸ ğ™’ğ™ğ™–ğ™©ğ™¨ğ™–ğ™¥ğ™¥     ğ’ğğ§ğ¢ğ§  ğ’ğšğ›ğ­ğ®     WIB ğŒğ¢ğ§ğ ğ ğ®    ğ—ğ—¹ ğ—ğ—› ğ—”ğ—µğ—ºğ—®ğ—± ğ——ğ—®ğ—µğ—¹ğ—®ğ—» ğ—¡ğ—¼ğ—ğ—½ ğ—•ğ—®ğ—¿ğ˜‚ ğ—ğ—²ğ—° ğ—•ğ—®ğ—¶ğ˜ğ˜‚ğ—¿ğ—¿ğ—®ğ—µğ—ºğ—®ğ—» ğ—ğ—¼ğ˜ğ—® ğ—•ğ—®ğ—»ğ—±ğ—® ğ—”ğ—°ğ—²ğ—µ ğ—ğ—¹ ğ—¦ğ—¿ğ—¶ ğ—¥ğ—®ğ˜ğ˜‚ ğ—¦ğ˜†ğ—®ğ—³ğ—¶ğ—®ğ˜ğ˜‚ğ—±ğ—±ğ—¶ğ—» ğ—¡ğ—¼ ğ—£ğ—²ğ˜‚ğ—»ğ—®ğ˜†ğ—¼ğ—»ğ—´ ğ—ğ—²ğ—° ğ—ğ˜‚ğ˜ğ—® ğ—”ğ—¹ğ—®ğ—º ğ—ğ—¼ğ˜ğ—® ğ—•ğ—®ğ—»ğ—±ğ—® ğ—”ğ—°ğ—²ğ—µ  lakmeindonesia lakmecosmetics lakmefashionweek lakmeabsolute buyonegetonefree buygetfree kosmetikmurah kosmetikviral trustyourself beautyjournal belanjacantik hanyadikotty ,lo,
20,Brown cut crease   PRODUCTS USED   lakmeindia  Lakme  absolute infinity eye shadow palette  Lakme  to  primer  matte perfect cover foundation c cool ivory  Lakme  absolute blur perfect makeup primer   Lakme eyeconic liquid liner  Lakme eyeconic curling mascara  PLEASE TAG lakmeindia  lakme lakmecosmetics lakmeeyeconic lakmeliner lakmeto browncutcrease liner fridaymakeup mua lakmelove eyemakeup eyeshadow shadoweye vrbeautybliss ,en,Brown cut crease   PRODUCTS USED   lakmeindia  Lakme  absolute infinity eye shadow palette  Lakme  to  primer  matte perfect cover foundation c cool ivory  Lakme  absolute blur perfect makeup primer   Lakme eyeconic liquid liner  Lakme eyeconic curling mascara  PLEASE TAG lakmeindia  lakme lakmecosmetics lakmeeyeconic lakmeliner lakmeto browncutcrease liner fridaymakeup mua lakmelove eyemakeup eyeshadow shadoweye vrbeautybliss 
21,Makeup can make a woman look more beautiful at every ageÂ smokeyeyemakeup softlook makeupnatural makeuplovers makeupartistdelhi makeupartist delhimakeupstudio cosmetics beautyproduct makeupinspiration delhimakeupartiest lakmecosmetics neha_jindal_ ,en,Makeup can make a woman look more beautiful at every ageÂ smokeyeyemakeup softlook makeupnatural makeuplovers makeupartistdelhi makeupartist delhimakeupstudio cosmetics beautyproduct makeupinspiration delhimakeupartiest lakmecosmetics neha_jindal_ 
22,  PRODUCTS USED   lakmeindia Lakme  absolute infinity eye shadow palette lakmeindia eyeconic kajal  deep black  royal blue lakmeindia  to  primer  matte perfect cover foundation c cool ivory lakmeindia absolute blur perfect makeup primer  lakmeindia eyeconic curling mascara  PLEASE TAG lakmeindia  lakme lakmecosmetics royalblueeyeshadow lakmeeyeconic lakmekajal lakmeto liner mua makeupoftheday lakmelove eyemakeup eyeshadow shadoweye vrbeautybliss ,en,  PRODUCTS USED   lakmeindia Lakme  absolute infinity eye shadow palette lakmeindia eyeconic kajal  deep black  royal blue lakmeindia  to  primer  matte perfect cover foundation c cool ivory lakmeindia absolute blur perfect makeup primer  lakmeindia eyeconic curling mascara  PLEASE TAG lakmeindia  lakme lakmecosmetics royalblueeyeshadow lakmeeyeconic lakmekajal lakmeto liner mua makeupoftheday lakmelove eyemakeup eyeshadow shadoweye vrbeautybliss 
23,Assalamualaikum PeepsHope you all r doing good REVIEW ALERT Today em herewith a review of well known product of Pakistan lakmepakistanofficial lakmeindia Lakme  to  bb cream the bb works perfectly well dry skin typeit skin care benefits include  protectionspf  coverage to give you a natural flawless lookgive you perfect look in just few minutes taxture  creamy and very light  Benefits give you instant glow  spf  easy to apply  affordable  best for dry skin got this from  alfatahofficial  lakmecosmeticslakmebblakmemakeupalfatehalfatahmakeupbloggerstylebloggersreviewssabmiltahaiLakmePakistan ,en,Assalamualaikum PeepsHope you all r doing good REVIEW ALERT Today em herewith a review of well known product of Pakistan lakmepakistanofficial lakmeindia Lakme  to  bb cream the bb works perfectly well dry skin typeit skin care benefits include  protectionspf  coverage to give you a natural flawless lookgive you perfect look in just few minutes taxture  creamy and very light  Benefits give you instant glow  spf  easy to apply  affordable  best for dry skin got this from  alfatahofficial  lakmecosmeticslakmebblakmemakeupalfatehalfatahmakeupbloggerstylebloggersreviewssabmiltahaiLakmePakistan 
24,LAKME  TO  NAIL PAINTS  DMCOMMENT TO BOOK YOUR ORDER  Payment options  PHONEPAYGPayPAYTM Available  Only for Rs per piece  makeup makeupproducts makeupideas makeupoftheday makeuplooks makeupaddict beautyproducts beauty cosmetics cosmeticproducts reasonableprice follow mac macproducts lakme  maccostemics macbbcream lakmeproducts lakmenailpolish lakmecosmetics lakmÃ© macmakeup followforfollowback followersinstagram followmypage followmakeuplooks followmakeup followmakeupproducts ,en,LAKME  TO  NAIL PAINTS  DMCOMMENT TO BOOK YOUR ORDER  Payment options  PHONEPAYGPayPAYTM Available  Only for Rs per piece  makeup makeupproducts makeupideas makeupoftheday makeuplooks makeupaddict beautyproducts beauty cosmetics cosmeticproducts reasonableprice follow mac macproducts lakme  maccostemics macbbcream lakmeproducts lakmenailpolish lakmecosmetics lakmÃ© macmakeup followforfollowback followersinstagram followmypage followmakeuplooks followmakeup followmakeupproducts 
25,Met de IPlex van LakmÃ© bescherm je het haar tegen alle chemische behandelingen in jouw salon Kleuren blonderen en permanenten is erg schadelijk voor het haar Wanneer je gebruik maakt van IPlex wordt het haar versterkt en krijgt het haar een voedende behandeling Met deze behandeling gaat jouw klant stralend de deur uit hairactionnl hairaction hairproducts haarproducten lakmecosmetics lakme ,nl,
26,Did this tatted eyeliner   PLEASE TAG lakmeindia On Comments If You Like It   IB  maryliascott  deemakeupart   Products used    lakmeindia  to  CC Complexion Care Cream   Bronze  lakmeindia  Eyeconic Eye Liner  lakmeindia  Insta Eye Liner  lakmeindia Eyeconic Kajal Black   lakme lakmelipstick lakmeeyeliner lakmeindia lakmÃ© lakmeto lakmemakeup lakmefoundation lakmeeyeconic lakmaoficial lakmelipstick lakmeabsolute lakmeproducts lakmecosmetics umashil feelwithuma makeupartist artistsoninstagram bhilai_chhattisgarh__ bhilaixuma chhattisgarh ilovelakme ,en,Did this tatted eyeliner   PLEASE TAG lakmeindia On Comments If You Like It   IB  maryliascott  deemakeupart   Products used    lakmeindia  to  CC Complexion Care Cream   Bronze  lakmeindia  Eyeconic Eye Liner  lakmeindia  Insta Eye Liner  lakmeindia Eyeconic Kajal Black   lakme lakmelipstick lakmeeyeliner lakmeindia lakmÃ© lakmeto lakmemakeup lakmefoundation lakmeeyeconic lakmaoficial lakmelipstick lakmeabsolute lakmeproducts lakmecosmetics umashil feelwithuma makeupartist artistsoninstagram bhilai_chhattisgarh__ bhilaixuma chhattisgarh ilovelakme 
27,once the things will disappear so choose wisely live your life as what makes you feel high and happy ANNIVERSARY MONTH SPECIAL        special anniversary happy queen fashion specialperson beautiful princess fashionstyle fashionphotography denimjacket prettygirls queenofhearts soulmatesneverdie hiscrazy kochi kerala indiaclicks livethemoment lifeisawesome meesho blackgown makeup nykaacosmetics lakmecosmetics gorgeousgirl gorgeousgirloftheday happiness hisworld hishappiness ,en,once the things will disappear so choose wisely live your life as what makes you feel high and happy ANNIVERSARY MONTH SPECIAL        special anniversary happy queen fashion specialperson beautiful princess fashionstyle fashionphotography denimjacket prettygirls queenofhearts soulmatesneverdie hiscrazy kochi kerala indiaclicks livethemoment lifeisawesome meesho blackgown makeup nykaacosmetics lakmecosmetics gorgeousgirl gorgeousgirloftheday happiness hisworld hishappiness 
28,La girl pro makeup setting powder in the stock   At just Rs  onlyy   We deliver all over India  within   days   Dm me for order and query please   lagirlproconcealer lakmecosmetics settingpowder professionalmakeupbrushset highlypigmentedeyeshadow smallbusiness skillshare professionalmakeup makeupoftheday magneticeyelashes makeuptransformation makeuptutorial ,en,La girl pro makeup setting powder in the stock   At just Rs  onlyy   We deliver all over India  within   days   Dm me for order and query please   lagirlproconcealer lakmecosmetics settingpowder professionalmakeupbrushset highlypigmentedeyeshadow smallbusiness skillshare professionalmakeup makeupoftheday magneticeyelashes makeuptransformation makeuptutorial 
29,Lakme lip crayons for  All shades are available  lakmelipcrayonlakmelakmemakeuplakmeproductslakmecolourlakmecosmeticsearnmoneyfromhomesupportsmallbusiness ,en,Lakme lip crayons for  All shades are available  lakmelipcrayonlakmelakmemakeuplakmeproductslakmecolourlakmecosmeticsearnmoneyfromhomesupportsmallbusiness 
30,    Face thapa_taniya  Makeup  _smashingshinebysouravita_    bridalmakeup bride lovemakeup makeuptutorial makeuplooks makeupartist makeuptransformation makeuplife makeupideas makeupaddict makeupaddict makeuplovers makeupart makeupinspiration makeupnaturalkryloncosmetics krylonmakeup maccosmetics lakmecosmetics bridalmakeup lakmeacademyrajendraplace lakmeacademycp lakmeacademydelhi beauty colorbarcosmetics colorfulmakeup creativemakeup indiantraditionalwear treditionallook ,en,    Face thapa_taniya  Makeup  _smashingshinebysouravita_    bridalmakeup bride lovemakeup makeuptutorial makeuplooks makeupartist makeuptransformation makeuplife makeupideas makeupaddict makeupaddict makeuplovers makeupart makeupinspiration makeupnaturalkryloncosmetics krylonmakeup maccosmetics lakmecosmetics bridalmakeup lakmeacademyrajendraplace lakmeacademycp lakmeacademydelhi beauty colorbarcosmetics colorfulmakeup creativemakeup indiantraditionalwear treditionallook 
