,Text,language,english
401,A Dolo helps you recover from sickness but not from frizzy hair dry skin and other side effects that the illness brings along For things it cant fix we have Happy Hair  Skin Plans  Experience the best of beauty  safety at your Safer Than Home LakmÃ© Salon With  safety measures we ensure you look good feel great  stay safe  Drop a  if you have availed our customized plans to embrace a HappyNewYou   us on    to reserve your spot on our priority list  Certified Safer Than Home based on a survey amongst  customers  LakmÃ©Salon Trending BackstageHeroes SaferThanHome SalonExperts TransformationBoss ,en,A Dolo helps you recover from sickness but not from frizzy hair dry skin and other side effects that the illness brings along For things it cant fix we have Happy Hair  Skin Plans  Experience the best of beauty  safety at your Safer Than Home LakmÃ© Salon With  safety measures we ensure you look good feel great  stay safe  Drop a  if you have availed our customized plans to embrace a HappyNewYou   us on    to reserve your spot on our priority list  Certified Safer Than Home based on a survey amongst  customers  LakmÃ©Salon Trending BackstageHeroes SaferThanHome SalonExperts TransformationBoss 
402,MagicMoments  Feeling the winter blues Tag your friends and head over to lakmesalonveeradesai to get your happy transformation   Flaunt happy blue tresses to embrace  a HappyNewYou who is bold unique and freespirited  Experience the best of beauty  safety at your Safer Than Home LakmÃ© Salon With  safety measures we ensure you look good feel great  stay safe   us on    to reserve your spot on our priority list  Certified Safer Than Home based on a survey amongst  customers   LakmeSalon BackstageHeroes SaferThanHome SalonExperts RevampYourLook Showstoppers InternationalBrands ExpertServices TrendiestServices BeautifyTheFuture BeautyWithSafety StaySafe SeeYouSoon BookYourAppointment FlauntYourStyle ,en,MagicMoments  Feeling the winter blues Tag your friends and head over to lakmesalonveeradesai to get your happy transformation   Flaunt happy blue tresses to embrace  a HappyNewYou who is bold unique and freespirited  Experience the best of beauty  safety at your Safer Than Home LakmÃ© Salon With  safety measures we ensure you look good feel great  stay safe   us on    to reserve your spot on our priority list  Certified Safer Than Home based on a survey amongst  customers   LakmeSalon BackstageHeroes SaferThanHome SalonExperts RevampYourLook Showstoppers InternationalBrands ExpertServices TrendiestServices BeautifyTheFuture BeautyWithSafety StaySafe SeeYouSoon BookYourAppointment FlauntYourStyle 
403,Make sure your happy hair  happy skin last forever with the correct aftercare products Avail our Customized Hair  Skin Plans and consult BackstageHeroes online to embrace a HappyNewYou  Experience the best of beauty  safety at your Safer Than Home LakmÃ© Salon With  safety measures we ensure you look good feel great  stay safe   URL  Tag your BFF  let them know your secret to happy hair  skin   us on    to reserve your spot on our priority list  Certified Safer Than Home based on a survey amongst  customers   LakmeSalon BackstageHeroes SaferThanHome SalonExperts RevampYourLook Showstoppers InternationalBrands ShopNow Dermalogica Lakme Schwarzkopf Moroccanoil ,en,Make sure your happy hair  happy skin last forever with the correct aftercare products Avail our Customized Hair  Skin Plans and consult BackstageHeroes online to embrace a HappyNewYou  Experience the best of beauty  safety at your Safer Than Home LakmÃ© Salon With  safety measures we ensure you look good feel great  stay safe   URL  Tag your BFF  let them know your secret to happy hair  skin   us on    to reserve your spot on our priority list  Certified Safer Than Home based on a survey amongst  customers   LakmeSalon BackstageHeroes SaferThanHome SalonExperts RevampYourLook Showstoppers InternationalBrands ShopNow Dermalogica Lakme Schwarzkopf Moroccanoil 
404,MagicMoments  Sway your scarlet tresses tap into your bold side and flaunt your free spirit   Experience the best of beauty  safety at your Safer Than Home LakmÃ© Salon With  safety measures we ensure you look good feel great  stay safe  Tag your BFF  get a happy makeover together at lakmesalonveeradesai to embrace a HappyNewYou   us on    to reserve your spot on our priority list  Certified Safer Than Home based on a survey amongst  customers   LakmeSalon BackstageHeroes SaferThanHome SalonExperts RevampYourLook Showstoppers InternationalBrands ExpertServices TrendiestServices BeautifyTheFuture BeautyWithSafety StaySafe SeeYouSoon BookYourAppointment FlauntYourStyle ,en,MagicMoments  Sway your scarlet tresses tap into your bold side and flaunt your free spirit   Experience the best of beauty  safety at your Safer Than Home LakmÃ© Salon With  safety measures we ensure you look good feel great  stay safe  Tag your BFF  get a happy makeover together at lakmesalonveeradesai to embrace a HappyNewYou   us on    to reserve your spot on our priority list  Certified Safer Than Home based on a survey amongst  customers   LakmeSalon BackstageHeroes SaferThanHome SalonExperts RevampYourLook Showstoppers InternationalBrands ExpertServices TrendiestServices BeautifyTheFuture BeautyWithSafety StaySafe SeeYouSoon BookYourAppointment FlauntYourStyle 
405,Deal with scars by looking at the Stars  makeuptoturial makeup makeupthebest makeupartist makeupdonebyme makeupandbeauty makeupoftheday makeuplovers    eyemakeupideas eyeshadow noeyeliner eyemakeuptutorial eyebrowshaping nudeeyemakeup eyemakeover lipsticklover lipstickaddict lipstikmatte blush   beauty beautyandthebeast beautyblogger beautyblog beautyproducts   cosmetics kryloncosmetics paccosmetics maccosmatics lakmecosmetics maybelline ,en,Deal with scars by looking at the Stars  makeuptoturial makeup makeupthebest makeupartist makeupdonebyme makeupandbeauty makeupoftheday makeuplovers    eyemakeupideas eyeshadow noeyeliner eyemakeuptutorial eyebrowshaping nudeeyemakeup eyemakeover lipsticklover lipstickaddict lipstikmatte blush   beauty beautyandthebeast beautyblogger beautyblog beautyproducts   cosmetics kryloncosmetics paccosmetics maccosmatics lakmecosmetics maybelline 
406,The moon never begs for attention makeuptoturial makeup makeupthebest makeupartist makeupdonebyme makeupandbeauty makeupoftheday makeuplovers    eyemakeupideas eyeshadow noeyeliner eyemakeuptutorial eyebrowshaping nudeeyemakeup eyemakeover lipsticklover lipstickaddict lipstikmatte blush   beauty beautyandthebeast beautyblogger beautyblog beautyproducts   cosmetics kryloncosmetics paccosmetics maccosmatics lakmecosmetics maybelline ,en,The moon never begs for attention makeuptoturial makeup makeupthebest makeupartist makeupdonebyme makeupandbeauty makeupoftheday makeuplovers    eyemakeupideas eyeshadow noeyeliner eyemakeuptutorial eyebrowshaping nudeeyemakeup eyemakeover lipsticklover lipstickaddict lipstikmatte blush   beauty beautyandthebeast beautyblogger beautyblog beautyproducts   cosmetics kryloncosmetics paccosmetics maccosmatics lakmecosmetics maybelline 
407,SelfCareSunday is here to remind you to take care of your body  mind   Indulge in a DeStress Massage  Hair Spa to rejuvenate for the coming week  Experience the best of beauty  safety at your Safer Than Home LakmÃ© Salon With  safety measures we ensure you look good feel great  stay safe  Drop a  if you want to start your week on a fresh note   us on    to reserve your spot on our priority list  Certified Safer Than Home based on a survey amongst  customers  LakmeSalon BackstageHeroes SaferThanHome SalonExperts Showstoppers InternationalBrands ExpertServices BeautifyTheFuture BeautyWithSafety StaySafe BookYourAppointment DestressMassage DestressSpa ,en,SelfCareSunday is here to remind you to take care of your body  mind   Indulge in a DeStress Massage  Hair Spa to rejuvenate for the coming week  Experience the best of beauty  safety at your Safer Than Home LakmÃ© Salon With  safety measures we ensure you look good feel great  stay safe  Drop a  if you want to start your week on a fresh note   us on    to reserve your spot on our priority list  Certified Safer Than Home based on a survey amongst  customers  LakmeSalon BackstageHeroes SaferThanHome SalonExperts Showstoppers InternationalBrands ExpertServices BeautifyTheFuture BeautyWithSafety StaySafe BookYourAppointment DestressMassage DestressSpa 
408,MagicMoments  Be a free spirit dance it off and swirl your tresses in colors as bright as you  Experience the best of beauty  safety at your Safer Than Home LakmÃ© Salon With  safety measures we ensure you look good feel great  stay safe  Tag your friends  remix this reel at lakmesalonpowai to embrace a HappyNewYou   us on    to reserve your spot on our priority list  Certified Safer Than Home based on a survey amongst  customers   LakmeSalon BackstageHeroes SaferThanHome SalonExperts RevampYourLook Showstoppers InternationalBrands ExpertServices TrendiestServices BeautifyTheFuture BeautyWithSafety StaySafe SeeYouSoon BookYourAppointment FlauntYourStyle ,en,MagicMoments  Be a free spirit dance it off and swirl your tresses in colors as bright as you  Experience the best of beauty  safety at your Safer Than Home LakmÃ© Salon With  safety measures we ensure you look good feel great  stay safe  Tag your friends  remix this reel at lakmesalonpowai to embrace a HappyNewYou   us on    to reserve your spot on our priority list  Certified Safer Than Home based on a survey amongst  customers   LakmeSalon BackstageHeroes SaferThanHome SalonExperts RevampYourLook Showstoppers InternationalBrands ExpertServices TrendiestServices BeautifyTheFuture BeautyWithSafety StaySafe SeeYouSoon BookYourAppointment FlauntYourStyle 
409,Drop a  if you want to ace your grooming game and embrace a HappyNewYou  LakmÃ© Salon X bombayshavingcompany bring to you premium grooming services to level up your beard  hair game  Experience the best of beauty  safety at your Safer Than Home LakmÃ© Salon With  safety measures we ensure you look good feel great  stay safe   us on    to reserve your spot on our priority list  Certified Safer Than Home based on a survey amongst  customers  LakmeSalon BackstageHeroes SaferThanHome SalonExperts RevampYourLook Showstoppers InternationalBrands ExpertServices TrendiestServices BeautifyTheFuture BeautyWithSafety StaySafe SeeYouSoon BookYourAppointment FlauntYourStyle ,en,Drop a  if you want to ace your grooming game and embrace a HappyNewYou  LakmÃ© Salon X bombayshavingcompany bring to you premium grooming services to level up your beard  hair game  Experience the best of beauty  safety at your Safer Than Home LakmÃ© Salon With  safety measures we ensure you look good feel great  stay safe   us on    to reserve your spot on our priority list  Certified Safer Than Home based on a survey amongst  customers  LakmeSalon BackstageHeroes SaferThanHome SalonExperts RevampYourLook Showstoppers InternationalBrands ExpertServices TrendiestServices BeautifyTheFuture BeautyWithSafety StaySafe SeeYouSoon BookYourAppointment FlauntYourStyle 
410,Get your hair  beard game on with LakmÃ© Salon   Avail professional grooming services from bombayshavingcompany to experience the best of beauty  safety at your Safer Than Home LakmÃ© Salon With  safety measures we ensure you look good feel great  stay safe  Tag your squad below and bring them along for a happy transformation to embrace a HappyNewYou   us on    to reserve your spot on our priority list  Certified Safer Than Home based on a survey amongst  customers  LakmeSalon BackstageHeroes SaferThanHome SalonExperts RevampYourLook Showstoppers InternationalBrands ExpertServices TrendiestServices BeautifyTheFuture BeautyWithSafety StaySafe SeeYouSoon BookYourAppointment FlauntYourStyle ,en,Get your hair  beard game on with LakmÃ© Salon   Avail professional grooming services from bombayshavingcompany to experience the best of beauty  safety at your Safer Than Home LakmÃ© Salon With  safety measures we ensure you look good feel great  stay safe  Tag your squad below and bring them along for a happy transformation to embrace a HappyNewYou   us on    to reserve your spot on our priority list  Certified Safer Than Home based on a survey amongst  customers  LakmeSalon BackstageHeroes SaferThanHome SalonExperts RevampYourLook Showstoppers InternationalBrands ExpertServices TrendiestServices BeautifyTheFuture BeautyWithSafety StaySafe SeeYouSoon BookYourAppointment FlauntYourStyle 
411,Drop a  if youve taken our Customized Plans yet If not what are you waiting for  Avail LakmÃ© For Life Packages with Customized Hair  Skin Plans and transform into a HappyNewYou   Experience the best of beauty  safety at your Safer Than Home LakmÃ© Salon With  safety measures we ensure you look good feel great  stay safe    us on    to reserve your spot on our priority list  Certified Safer Than Home based on a survey amongst  customers  LakmeSalon BackstageHeroes SaferThanHome SalonExperts RevampYourLook Showstoppers InternationalBrands ExpertServices TrendiestServices BeautifyTheFuture BeautyWithSafety StaySafe SeeYouSoon BookYourAppointment FlauntYourStyle ,en,Drop a  if youve taken our Customized Plans yet If not what are you waiting for  Avail LakmÃ© For Life Packages with Customized Hair  Skin Plans and transform into a HappyNewYou   Experience the best of beauty  safety at your Safer Than Home LakmÃ© Salon With  safety measures we ensure you look good feel great  stay safe    us on    to reserve your spot on our priority list  Certified Safer Than Home based on a survey amongst  customers  LakmeSalon BackstageHeroes SaferThanHome SalonExperts RevampYourLook Showstoppers InternationalBrands ExpertServices TrendiestServices BeautifyTheFuture BeautyWithSafety StaySafe SeeYouSoon BookYourAppointment FlauntYourStyle 
412,Bridestobe excited for your upcoming Dday Flaunt your dream wedding look with the help of our BackstageHeroes  Drop your safety concerns and other queries in the comments below and rest assured while we tell you about  measures at our salons    us on    to reserve your spot on our priority list  Outfit studybyjanak vandymehra sonalikatyalmehra  Jewellery multanijewellersofficial radhikaandneenusartistry  Muse aneeshaprakashh ridhisamrat theshivanichaudhary ashishfashionmilitary meghnadutt   LakmeSalon BackstageHeroes SaferThanHome Makeup Bridesmaid PartyMakeup BrideSquad WeddingGoals BridesOfIndia IndianWedding IndianBrides ,en,Bridestobe excited for your upcoming Dday Flaunt your dream wedding look with the help of our BackstageHeroes  Drop your safety concerns and other queries in the comments below and rest assured while we tell you about  measures at our salons    us on    to reserve your spot on our priority list  Outfit studybyjanak vandymehra sonalikatyalmehra  Jewellery multanijewellersofficial radhikaandneenusartistry  Muse aneeshaprakashh ridhisamrat theshivanichaudhary ashishfashionmilitary meghnadutt   LakmeSalon BackstageHeroes SaferThanHome Makeup Bridesmaid PartyMakeup BrideSquad WeddingGoals BridesOfIndia IndianWedding IndianBrides 
413,MagicMoments  Drop a  if you agree that a classic red bridal look is unbeatable  We cant peel our eyes off of Surbhi in her stunning traditional ensemble with pink blush red lips and smoldering eyes styled by our expert Gurvinder Kour at lakmesalonchanni   us on    to reserve your spot on our priority list  LakmeSalon BackstageHeroes SaferThanHome Makeup Bridesmaid BrideSquad WeddingGoals BridesOfIndia IndianWedding IndianBrides ,en,MagicMoments  Drop a  if you agree that a classic red bridal look is unbeatable  We cant peel our eyes off of Surbhi in her stunning traditional ensemble with pink blush red lips and smoldering eyes styled by our expert Gurvinder Kour at lakmesalonchanni   us on    to reserve your spot on our priority list  LakmeSalon BackstageHeroes SaferThanHome Makeup Bridesmaid BrideSquad WeddingGoals BridesOfIndia IndianWedding IndianBrides 
414,Color me blue color me yellow color me pink color me bold  Which color describes you Comment below   Be a freespirit express yourself with colors that define you  embrace a HappyNewYou   us on    to reserve your spot on our priority list  LakmeSalon HappyHair HappyTresses HairColor HairTransformation HairColorInspiration BookYourAppointment FlauntYourStyle HairCare Nourish Shine ,en,Color me blue color me yellow color me pink color me bold  Which color describes you Comment below   Be a freespirit express yourself with colors that define you  embrace a HappyNewYou   us on    to reserve your spot on our priority list  LakmeSalon HappyHair HappyTresses HairColor HairTransformation HairColorInspiration BookYourAppointment FlauntYourStyle HairCare Nourish Shine 
415,Loved how this look made my eyes pop   lakmeindia   Lakme Absolute infinity eye shadow  palette   Lakme eyeconic kajal  Lakme  to  primer  matte perfect cover foundation   Lakme eyeconic curling mascara  Lakme Absolute precision eye artist eyebrow pencil   lakme lakmecosmetics lakmekajal lakmeeyeshadow shadoweye eyeshadow blackeye makeupoftheday makeup makeuplover blackeyeshadow  thursdaymakeup blackbrowneye blacksmokeyeye mua vrbeautybliss ,en,Loved how this look made my eyes pop   lakmeindia   Lakme Absolute infinity eye shadow  palette   Lakme eyeconic kajal  Lakme  to  primer  matte perfect cover foundation   Lakme eyeconic curling mascara  Lakme Absolute precision eye artist eyebrow pencil   lakme lakmecosmetics lakmekajal lakmeeyeshadow shadoweye eyeshadow blackeye makeupoftheday makeup makeuplover blackeyeshadow  thursdaymakeup blackbrowneye blacksmokeyeye mua vrbeautybliss 
416,Now every day can be a Good Hair Day Want to know how Avail our Customized Hair  Skin Plans and flaunt happy hair  happy skin every day Its time to embrace a HappyNewYou  Share your beauty woes in the comments below and well get our BackstageHeroes to solve them   us on    to reserve your spot on our priority list  LakmeSalon BackstageHeroes SaferThanHome SalonExperts InternationalBrands ExpertServices BeautyWithSafety StaySafe BookYourAppointment HealthyHair ,en,Now every day can be a Good Hair Day Want to know how Avail our Customized Hair  Skin Plans and flaunt happy hair  happy skin every day Its time to embrace a HappyNewYou  Share your beauty woes in the comments below and well get our BackstageHeroes to solve them   us on    to reserve your spot on our priority list  LakmeSalon BackstageHeroes SaferThanHome SalonExperts InternationalBrands ExpertServices BeautyWithSafety StaySafe BookYourAppointment HealthyHair 
417,Spin to Win with LakmÃ© Salon Transform yourself and embrace a HappyNewYou by crushing your Resolutions with   LakmÃ© For Life Packages  Customized Hair Skin  Body Plans  Free Fitness Pass  TC Apply  Click to Spin  Win big discounts Link in bio  LakmeSalon SkinTransformation BodyTransformation TransformationBoss SpinTheWheel HappySkin HappyBody HappyHair Transformation BookYourAppointment NewYear ExperienceBeautyInsideOut ,en,Spin to Win with LakmÃ© Salon Transform yourself and embrace a HappyNewYou by crushing your Resolutions with   LakmÃ© For Life Packages  Customized Hair Skin  Body Plans  Free Fitness Pass  TC Apply  Click to Spin  Win big discounts Link in bio  LakmeSalon SkinTransformation BodyTransformation TransformationBoss SpinTheWheel HappySkin HappyBody HappyHair Transformation BookYourAppointment NewYear ExperienceBeautyInsideOut 
418,MagicMoments  Save this post to share with your bridetobe BFF Deepanshis magnificent bridal look is a sight for sore eyes   Her outfit is accentuated with her shimmery eyes bronze highlights  nudebrown lips styled by our expert Pooja Mishra at lakmesalonmoradabad    us on    to reserve your spot on our priority list  LakmeSalon BackstageHeroes SaferThanHome Makeup Bridesmaid PartyMakeup BrideSquad WeddingGoals BridesOfIndia IndianWedding IndianBrides ,en,MagicMoments  Save this post to share with your bridetobe BFF Deepanshis magnificent bridal look is a sight for sore eyes   Her outfit is accentuated with her shimmery eyes bronze highlights  nudebrown lips styled by our expert Pooja Mishra at lakmesalonmoradabad    us on    to reserve your spot on our priority list  LakmeSalon BackstageHeroes SaferThanHome Makeup Bridesmaid PartyMakeup BrideSquad WeddingGoals BridesOfIndia IndianWedding IndianBrides 
419,Your alarms are reminding you to nourish your skin  hair with essential ingredients  Will you snooze or will you embrace a HappyNewYou Go on comment below   Avail our Customized Plans to say hello to a healthy happy you   us on    to reserve your spot on our priority list  LakmeSalon BackstageHeroes SaferThanHome SalonExperts InternationalBrands ExpertServices BeautyWithSafety StaySafe BookYourAppointment HealthyHair ,en,Your alarms are reminding you to nourish your skin  hair with essential ingredients  Will you snooze or will you embrace a HappyNewYou Go on comment below   Avail our Customized Plans to say hello to a healthy happy you   us on    to reserve your spot on our priority list  LakmeSalon BackstageHeroes SaferThanHome SalonExperts InternationalBrands ExpertServices BeautyWithSafety StaySafe BookYourAppointment HealthyHair 
420,MagicMoments  Drop a  if you agree that Akriti looks like a star in this evening ensemble   Pink lips and eyes with a hint of glitter styled by our expert Shalika Dixit at lakmesalonkidwainagar has got us blushing   us on    to reserve your spot on our priority list  LakmeSalon BackstageHeroes SaferThanHome Makeup Bridesmaid PartyMakeup BrideSquad WeddingGoals BridesOfIndia IndianWedding IndianBrides ,en,MagicMoments  Drop a  if you agree that Akriti looks like a star in this evening ensemble   Pink lips and eyes with a hint of glitter styled by our expert Shalika Dixit at lakmesalonkidwainagar has got us blushing   us on    to reserve your spot on our priority list  LakmeSalon BackstageHeroes SaferThanHome Makeup Bridesmaid PartyMakeup BrideSquad WeddingGoals BridesOfIndia IndianWedding IndianBrides 
421,SelfCareSunday is here to remind you to enjoy the little moments in life and leave behind a vibrant trail of memories as colorful as your tresses  Tag your friends to create a fun hair transformation memory with them   us on    to reserve your spot on our priority list  LakmeSalon SelfCare HappyHair HappyTresses HairColor HairTransformation HairColorInspiration BookYourAppointment FlauntYourStyle HairCare ,en,SelfCareSunday is here to remind you to enjoy the little moments in life and leave behind a vibrant trail of memories as colorful as your tresses  Tag your friends to create a fun hair transformation memory with them   us on    to reserve your spot on our priority list  LakmeSalon SelfCare HappyHair HappyTresses HairColor HairTransformation HairColorInspiration BookYourAppointment FlauntYourStyle HairCare 
422,Comment below to experience beauty insideout the way you like it with the ConstitutionOfBeauty and stand a chance to WIN exciting gift vouchers from onlyindia and appliances from vegabeauty   This RepublicDay embrace a HappyNewYou with your goto services at your Safer Than Home LakmÃ© Salon   LakmeSalon HappyRepublicDay Makeover BackstageHeroes SaferThanHome SalonExperts RevampYourLook InternationalBrands ExpertServices TrendiestServices ,en,Comment below to experience beauty insideout the way you like it with the ConstitutionOfBeauty and stand a chance to WIN exciting gift vouchers from onlyindia and appliances from vegabeauty   This RepublicDay embrace a HappyNewYou with your goto services at your Safer Than Home LakmÃ© Salon   LakmeSalon HappyRepublicDay Makeover BackstageHeroes SaferThanHome SalonExperts RevampYourLook InternationalBrands ExpertServices TrendiestServices 
423,Experience beauty insideout with the ConstitutionOfBeauty to embrace a HappyNewYou   LakmÃ© Salon family wishes you a HappyRepublicDay   LakmeSalon RepublicDay Makeover BackstageHeroes SaferThanHome SalonExperts RevampYourLook InternationalBrands ExpertServices TrendiestServices ,en,Experience beauty insideout with the ConstitutionOfBeauty to embrace a HappyNewYou   LakmÃ© Salon family wishes you a HappyRepublicDay   LakmeSalon RepublicDay Makeover BackstageHeroes SaferThanHome SalonExperts RevampYourLook InternationalBrands ExpertServices TrendiestServices 
424,Also todays mood Protein Rush Hair Spa and Goodbye Tan Facial   Why should men stay away from all the fun Tag your friends get a cool makeover   us on    to reserve your spot on our priority list  LakmeSalon BackstageHeroes SaferThanHome SalonExperts RevampYourLook HappyHair HappyTresses HairColor HairTransformation HairColorInspiration BookYourAppointment ,en,Also todays mood Protein Rush Hair Spa and Goodbye Tan Facial   Why should men stay away from all the fun Tag your friends get a cool makeover   us on    to reserve your spot on our priority list  LakmeSalon BackstageHeroes SaferThanHome SalonExperts RevampYourLook HappyHair HappyTresses HairColor HairTransformation HairColorInspiration BookYourAppointment 
